id,cve_id,description,cvss_score,cvss_vector,epss_score,epss_percentile,published,vendor,product,is_in_kev,is_in_nist,references,created_at,updated_at
1,CVE-2026-20131,"A vulnerability in the web-based management interface of Cisco Secure Firewall Management Center (FMC) Software could allow an unauthenticated, remote attacker to execute arbitrary Java code as root on an affected device.

 This vulnerability is due to insecure deserialization of a user-supplied Java byte stream. An attacker could exploit this vulnerability by sending a crafted serialized Java object to the web-based management interface of an affected device. A successful exploit could allow t",10,,0.06,0.9,2026-03-19,Cisco,Secure Firewall Management Center (FMC),1,1,[],2026-03-20 01:05:35.325645,2026-04-06 20:51:34.374924
2,CVE-2025-66376,Zimbra Collaboration (ZCS) 10 before 10.0.18 and 10.1 before 10.1.13 allows Classic UI stored XSS via Cascading Style Sheets (CSS) @import directives in an HTML e-mail message.,7.2,,0.29,0.96,2026-01-05,Synacor,Zimbra Collaboration Suite (ZCS),1,1,[],2026-03-20 01:05:35.327535,2026-03-21 23:19:56.169766
3,CVE-2026-20963,Deserialization of untrusted data in Microsoft Office SharePoint allows an authorized attacker to execute code over a network.,8.8,,0.05,0.9,2026-03-18,Microsoft,SharePoint,1,1,[],2026-03-20 01:05:35.329224,2026-04-06 20:51:34.377139
4,CVE-2025-47813,loginok.html in Wing FTP Server before 7.4.4 discloses the full local installation path of the application when using a long value in the UID cookie.,4.3,,0.21,0.96,2025-07-10,Wing FTP Server,Wing FTP Server,1,1,[],2026-03-20 01:05:35.331080,2026-03-21 23:23:45.329456
5,CVE-2026-3910,Inappropriate implementation in V8 in Google Chrome prior to 146.0.7680.75 allowed a remote attacker to execute arbitrary code inside a sandbox via a crafted HTML page. (Chromium security severity: High),8.8,,0.11,0.93,2026-03-13,Google,Chromium V8,1,1,[],2026-03-20 01:05:35.332364,2026-04-06 20:51:34.379445
6,CVE-2026-3909,Out of bounds write in Skia in Google Chrome prior to 146.0.7680.75 allowed a remote attacker to perform out of bounds memory access via a crafted HTML page. (Chromium security severity: High),8.8,,0.33,0.97,2026-03-13,Google,Skia,1,1,[],2026-03-20 01:05:35.333649,2026-04-06 20:51:34.381617
7,CVE-2025-68613,n8n contains an improper control of dynamically managed code resources vulnerability in its workflow expression evaluation system that allows for remote code execution.,9.9,CVSS:3.1/AV:N/AC:L/PR:L/UI:N/S:C/C:H/I:H/A:H,0.76931,0.9894,2025-12-19,n8n,n8n,1,1,[],2026-03-20 01:05:35.334987,2026-03-21 02:07:16.250845
8,CVE-2021-22054,"VMware Workspace ONE UEM console 20.0.8 prior to 20.0.8.37, 20.11.0 prior to 20.11.0.40, 21.2.0 prior to 21.2.0.27, and 21.5.0 prior to 21.5.0.37 contain an SSRF vulnerability. This issue may allow a malicious actor with network access to UEM to send their requests without authentication and to gain access to sensitive information.",7.5,,0.94,1,2026-03-09,Omnissa,Workspace One UEM,1,1,[],2026-03-20 01:05:35.336899,2026-04-06 20:51:34.383722
9,CVE-2025-26399,"SolarWinds Web Help Desk was found to be susceptible to an unauthenticated AjaxProxy deserialization remote code execution vulnerability that, if exploited, would allow an attacker to run commands on the host machine. This vulnerability is a patch bypass of CVE-2024-28988, which in turn is a patch bypass of CVE-2024-28986.",9.8,,0.29,0.96,2026-03-09,SolarWinds,Web Help Desk,1,1,[],2026-03-20 01:05:35.338493,2026-04-06 20:51:34.385796
10,CVE-2026-1603,An authentication bypass in Ivanti Endpoint Manager before version 2024 SU5 allows a remote unauthenticated attacker to leak specific stored credential data.,8.6,,0.46,0.98,2026-03-09,Ivanti, Endpoint Manager (EPM),1,1,[],2026-03-20 01:05:35.340083,2026-04-06 20:51:34.387972
11,CVE-2017-7921,"An Improper Authentication issue was discovered in Hikvision DS-2CD2xx2F-I Series V5.2.0 build 140721 to V5.4.0 build 160530, DS-2CD2xx0F-I Series V5.2.0 build 140721 to V5.4.0 Build 160401, DS-2CD2xx2FWD Series V5.3.1 build 150410 to V5.4.4 Build 161125, DS-2CD4x2xFWD Series V5.2.0 build 140721 to V5.4.0 Build 160414, DS-2CD4xx5 Series V5.2.0 build 140721 to V5.4.0 Build 160421, DS-2DFx Series V5.2.0 build 140805 to V5.4.5 Build 160928, and DS-2CD63xx Series V5.0.9 build 140305 to V5.3.5 Build ",9.8,CVSS:3.1/AV:N/AC:L/PR:N/UI:N/S:U/C:H/I:H/A:H,0.94,1,2017-05-06,Hikvision,Multiple Products,1,1,[],2026-03-20 01:05:35.341827,2026-03-21 21:37:14.214542
12,CVE-2021-22681,"Rockwell Automation Studio 5000 Logix Designer Versions 21 and later, and RSLogix 5000 Versions 16 through 20 use a key to verify Logix controllers are communicating with Rockwell Automation CompactLogix 1768, 1769, 5370, 5380, 5480: ControlLogix 5550, 5560, 5570, 5580; DriveLogix 5560, 5730, 1794-L34; Compact GuardLogix 5370, 5380; GuardLogix 5570, 5580; SoftLogix 5800. Rockwell Automation Studio 5000 Logix Designer Versions 21 and later and RSLogix 5000: Versions 16 through 20 are vulnerable b",9.8,,0.18,0.95,2021-03-03,Rockwell,Multiple Products,1,1,[],2026-03-20 01:05:35.343168,2026-03-22 15:34:00.667228
13,CVE-2023-43000,"A use-after-free issue was addressed with improved memory management. This issue is fixed in macOS Ventura 13.5, iOS 16.6 and iPadOS 16.6, Safari 16.6, iOS 15.8.7 and iPadOS 15.8.7. Processing maliciously crafted web content may lead to memory corruption.",8.8,,0,0.26,2025-11-05,Apple,Multiple Products,1,1,[],2026-03-20 01:05:35.345096,2026-03-21 23:57:19.486727
14,CVE-2021-30952,"An integer overflow was addressed with improved input validation. This issue is fixed in tvOS 15.2, macOS Monterey 12.1, Safari 15.2, iOS 15.2 and iPadOS 15.2, watchOS 8.3. Processing maliciously crafted web content may lead to arbitrary code execution.",7.8,,0.02,0.82,2021-08-24,Apple,Multiple Products,1,1,[],2026-03-20 01:05:35.346098,2026-03-21 23:45:36.285537
15,CVE-2023-41974,"A use-after-free issue was addressed with improved memory management. This issue is fixed in iOS 17 and iPadOS 17, iOS 15.8.7 and iPadOS 15.8.7. An app may be able to execute arbitrary code with kernel privileges.",7.8,,0.01,0.72,2024-01-10,Apple,iOS and iPadOS,1,1,[],2026-03-20 01:05:35.347076,2026-03-21 23:52:01.627896
16,CVE-2026-22719,"VMware Aria Operations contains a command injection vulnerability. A malicious unauthenticated actor may exploit this issue to execute arbitrary commands which may lead to remote code execution in VMware Aria Operations while support-assisted product migration is in progress. 

To remediate CVE-2026-22719, apply the patches listed in the 'Fixed Version' column of the ' Response Matrix https://support.broadcom.com/web/ecx/support-content-notification/-/external/content/SecurityAdvisories/0/36947 ",8.1,,0.07,0.92,2026-03-03,Broadcom,VMware Aria Operations,1,1,[],2026-03-20 01:05:35.348153,2026-04-06 20:51:34.390212
17,CVE-2026-21385,Memory corruption while using alignments for memory allocation.,7.8,,0,0.59,2026-03-02,Qualcomm,Multiple Chipsets,1,1,[],2026-03-20 01:05:35.349376,2026-03-21 23:53:41.242211
18,CVE-2022-20775,"A vulnerability in the CLI of Cisco SD-WAN Software could allow an authenticated, local attacker to gain elevated privileges.

This vulnerability is due to improper access controls on commands within the application CLI. An attacker could exploit this vulnerability by running a maliciously crafted command on the application CLI. A successful exploit could allow the attacker to execute arbitrary commands as the root user.
Cisco has released software updates that address this vulnerability. The",7.8,CVSS:3.1/AV:L/AC:L/PR:L/UI:N/S:U/C:H/I:H/A:H,0.01,0.66,2026-02-25,Cisco,SD-WAN,1,1,[],2026-03-20 01:05:35.350331,2026-04-06 20:51:34.392398
19,CVE-2026-20127,"A vulnerability in the peering authentication in Cisco Catalyst SD-WAN Controller, formerly SD-WAN vSmart, and Cisco Catalyst SD-WAN Manager, formerly SD-WAN vManage, could allow an unauthenticated, remote attacker to bypass authentication and obtain administrative privileges on an affected system.

This vulnerability exists because the peering authentication mechanism in an affected system is not working properly. An attacker could exploit this vulnerability by sending crafted requests to an ",10,,0.03,0.85,2026-02-25,Cisco,Catalyst SD-WAN Controller and Manager,1,1,[],2026-03-20 01:05:35.351188,2026-04-06 20:51:34.394566
20,CVE-2026-25108,"FileZen contains an OS command injection vulnerability. When FileZen Antivirus Check Option is enabled, a logged-in user may send a specially crafted HTTP request to execute an arbitrary OS command.",8.8,,0.23,0.96,2026-02-13,Soliton Systems K.K,FileZen,1,1,[],2026-03-20 01:05:35.352167,2026-03-21 23:23:14.359480
21,CVE-2025-49113,"Roundcube Webmail before 1.5.10 and 1.6.x before 1.6.11 allows remote code execution by authenticated users because the _from parameter in a URL is not validated in program/actions/settings/upload.php, leading to PHP Object Deserialization.",9.9,,0.9,1,2025-06-02,Roundcube,Webmail,1,1,[],2026-03-20 01:05:35.353386,2026-03-21 22:43:57.423633
22,CVE-2025-68461,RoundCube Webmail contains a cross-site scripting vulnerability via the animate tag in an SVG document.,7.2,CVSS:3.1/AV:N/AC:L/PR:N/UI:N/S:C/C:L/I:L/A:N,0.06348,0.90887,2025-12-18,Roundcube,Webmail,1,1,[],2026-03-20 01:05:35.354616,2026-03-21 02:07:16.678629
23,CVE-2021-22175,"When requests to the internal network for webhooks are enabled, a server-side request forgery vulnerability in GitLab affecting all versions starting from 10.5 was possible to exploit for an unauthenticated attacker even on a GitLab instance where registration is disabled",6.8,,0.74,0.99,2026-02-18,GitLab,GitLab,1,1,[],2026-03-20 01:05:35.355833,2026-04-06 20:51:34.396690
24,CVE-2026-22769,"Dell RecoverPoint for Virtual Machines, versions prior to 6.0.3.1 HF1, contain a hardcoded credential vulnerability. This is considered critical as an unauthenticated remote attacker with knowledge of the hardcoded credential could potentially exploit this vulnerability leading to unauthorized access to the underlying operating system and root-level persistence. Dell recommends that customers upgrade or apply one of the remediations as soon as possible.",10,,0.34,0.97,2026-02-17,Dell,RecoverPoint for Virtual Machines (RP4VMs),1,1,[],2026-03-20 01:05:35.357624,2026-03-21 23:16:19.642232
25,CVE-2020-7796,Zimbra Collaboration Suite (ZCS) before 8.8.15 Patch 7 allows SSRF when WebEx zimlet is installed and zimlet JSP is enabled.,9.8,CVSS:3.1/AV:N/AC:L/PR:N/UI:N/S:U/C:H/I:H/A:H,0.94,1,2020-02-18,Synacor,Zimbra Collaboration Suite,1,1,[],2026-03-20 01:05:35.358862,2026-03-21 21:40:08.162371
26,CVE-2024-7694,"ThreatSonar Anti-Ransomware from TeamT5 does not properly validate the content of uploaded files. Remote attackers with  administrator privileges on the product platform can upload malicious files, which can be used to execute arbitrary system command on the server.",7.2,,0.02,0.82,2024-08-12,TeamT5,ThreatSonar Anti-Ransomware,1,1,[],2026-03-20 01:05:35.359857,2026-03-21 23:45:30.137264
27,CVE-2008-0015,"Stack-based buffer overflow in the CComVariant::ReadFromStream function in the Active Template Library (ATL), as used in the MPEG2TuneRequest ActiveX control in msvidctl.dll in DirectShow, in Microsoft Windows 2000 SP4, XP SP2 and SP3, Server 2003 SP2, Vista Gold, SP1, and SP2, and Server 2008 Gold and SP2 allows remote attackers to execute arbitrary code via a crafted web page, as exploited in the wild in July 2009, aka ""Microsoft Video ActiveX Control Vulnerability.""",8.8,CVSS:3.1/AV:N/AC:L/PR:N/UI:R/S:U/C:H/I:H/A:H,0.81,0.99,2026-02-17,Microsoft,Windows,1,1,[],2026-03-20 01:05:35.360849,2026-04-06 20:51:34.398936
28,CVE-2026-2441,Use after free in CSS in Google Chrome prior to 145.0.7632.75 allowed a remote attacker to execute arbitrary code inside a sandbox via a crafted HTML page. (Chromium security severity: High),8.8,,0,0.35,2026-02-17,Google,Chromium,1,1,[],2026-03-20 01:05:35.361829,2026-04-06 20:51:34.401160
29,CVE-2026-1731,"BeyondTrust Remote Support (RS) and certain older versions of Privileged Remote Access (PRA) contain a critical pre-authentication remote code execution vulnerability. By sending specially crafted requests, an unauthenticated remote attacker may be able to execute operating system commands in the context of the site user.",9.8,,0.72,0.99,2026-02-06,BeyondTrust,Remote Support (RS) and Privileged Remote Access (PRA),1,1,[],2026-03-20 01:05:35.363053,2026-03-21 23:02:10.165223
30,CVE-2026-20700,"Apple iOS, macOS, tvOS, watchOS, and visionOS contain an improper restriction of operations within the bounds of a memory buffer vulnerability that could allow an attacker with memory write the capability to execute arbitrary code.",7.8,CVSS:3.1/AV:L/AC:L/PR:L/UI:N/S:U/C:H/I:H/A:H,0.0051,0.66143,2026-02-11,Apple,Multiple Products,1,1,[],2026-03-20 01:05:35.364273,2026-03-21 02:07:16.677173
31,CVE-2024-43468,Microsoft Configuration Manager Remote Code Execution Vulnerability,9.8,,0.85,0.99,2026-02-12,Microsoft,Configuration Manager,1,1,[],2026-03-20 01:05:35.365134,2026-04-06 20:51:34.403489
32,CVE-2025-15556,"Notepad++ versions prior to 8.8.9, when using the WinGUp updater, contain an update integrity verification vulnerability where downloaded update metadata and installers are not cryptographically verified. An attacker able to intercept or redirect update traffic can cause the updater to download and execute an attacker-controlled installer, resulting in arbitrary code execution with the privileges of the user.",7.5,,0.06,0.9,2026-02-03,Notepad++,Notepad++,1,1,[],2026-03-20 01:05:35.366353,2026-03-21 23:36:23.424987
33,CVE-2025-40536,"SolarWinds Web Help Desk was found to be susceptible to a security control bypass vulnerability that if exploited, could allow an unauthenticated attacker to gain access to certain restricted functionality.",8.1,,0.69,0.99,2026-02-12,SolarWinds,Web Help Desk,1,1,[],2026-03-20 01:05:35.367587,2026-04-06 20:51:34.405356
34,CVE-2026-21513,Protection mechanism failure in MSHTML Framework allows an unauthorized attacker to bypass a security feature over a network.,8.8,,0.06,0.9,2026-02-10,Microsoft,Windows,1,1,[],2026-03-20 01:05:35.368743,2026-04-06 20:51:34.407603
35,CVE-2026-21525,Null pointer dereference in Windows Remote Access Connection Manager allows an unauthorized attacker to deny service locally.,6.2,,0.04,0.88,2026-02-10,Microsoft,Windows,1,1,[],2026-03-20 01:05:35.369711,2026-04-06 20:51:34.409637
36,CVE-2026-21510,Protection mechanism failure in Windows Shell allows an unauthorized attacker to bypass a security feature over a network.,8.8,,0.04,0.89,2026-02-10,Microsoft,Windows,1,1,[],2026-03-20 01:05:35.370657,2026-04-06 20:51:34.411544
37,CVE-2026-21533,Improper privilege management in Windows Remote Desktop allows an authorized attacker to elevate privileges locally.,7.8,,0.03,0.87,2026-02-10,Microsoft,Windows,1,1,[],2026-03-20 01:05:35.371875,2026-04-06 20:51:34.413598
38,CVE-2026-21519,Access of resource using incompatible type ('type confusion') in Desktop Window Manager allows an authorized attacker to elevate privileges locally.,7.8,CVSS:3.1/AV:L/AC:L/PR:L/UI:N/S:U/C:H/I:H/A:H,0.04,0.88,2026-02-10,Microsoft,Windows,1,1,[],2026-03-20 01:05:35.373101,2026-04-06 20:51:34.415631
39,CVE-2026-21514,Reliance on untrusted inputs in a security decision in Microsoft Office Word allows an unauthorized attacker to bypass a security feature locally.,7.8,,0.05,0.9,2026-02-10,Microsoft,Office,1,1,[],2026-03-20 01:05:35.374318,2026-04-06 20:51:34.417756
40,CVE-2025-11953,"The Metro Development Server, which is opened by the React Native Community CLI, binds to external interfaces by default. The server exposes an endpoint that is vulnerable to OS command injection. This allows unauthenticated network attackers to send a POST request to the server and run arbitrary executables. On Windows, the attackers can also execute arbitrary shell commands with fully controlled arguments.",9.8,,0.03,0.87,2025-11-03,React Native Community,CLI,1,1,[],2026-03-20 01:05:35.375657,2026-03-22 15:35:52.500813
41,CVE-2026-24423,"SmarterTools SmarterMail versions prior to build 9511 contain an unauthenticated remote code execution vulnerability in the ConnectToHub API method. The attacker could point the SmarterMail to the malicious HTTP server, which serves the malicious OS command. This command will be executed by the vulnerable application.",9.8,CVSS:3.1/AV:N/AC:L/PR:N/UI:N/S:U/C:H/I:H/A:H,0.3,0.97,2026-01-23,SmarterTools,SmarterMail,1,1,[],2026-03-20 01:05:35.376859,2026-03-21 21:44:39.864436
42,CVE-2021-39935,"An issue has been discovered in GitLab CE/EE affecting all versions starting from 10.5 before 14.3.6, all versions starting from 14.4 before 14.4.4, all versions starting from 14.5 before 14.5.2. Unauthorized external users could perform Server Side Requests via the CI Lint API",6.8,,0.54,0.98,2026-02-03,GitLab,Community and Enterprise Editions,1,1,[],2026-03-20 01:05:35.377810,2026-04-06 20:51:34.419890
43,CVE-2025-64328,"FreePBX Endpoint Manager is a module for managing telephony endpoints in FreePBX systems. In versions 17.0.2.36 and above before 17.0.3, the filestore module within the Administrative interface is vulnerable to a post-authentication command injection by an authenticated known user via the testconnection -> check_ssh_connect() function. An attacker can leverage this vulnerability to obtain remote access to the system as an asterisk user. This issue is fixed in version 17.0.3.",7.2,,0.85,0.99,2025-11-07,Sangoma,FreePBX ,1,1,[],2026-03-20 01:05:35.378652,2026-03-21 22:51:24.660861
44,CVE-2019-19006,"Sangoma FreePBX 115.0.16.26 and below, 14.0.13.11 and below, 13.0.197.13 and below have Incorrect Access Control.",9.8,,0.27,0.96,2019-11-21,Sangoma,FreePBX,1,1,[],2026-03-20 01:05:35.379608,2026-03-21 23:20:39.518067
45,CVE-2025-40551,"SolarWinds Web Help Desk was found to be susceptible to an untrusted data deserialization vulnerability that could lead to remote code execution, which would allow an attacker to run commands on the host machine. This could be exploited without authentication.",9.8,,0.81,0.99,2026-02-03,SolarWinds,Web Help Desk,1,1,[],2026-03-20 01:05:35.380563,2026-04-06 20:51:34.422154
46,CVE-2026-1281,A code injection in Ivanti Endpoint Manager Mobile allowing attackers to achieve unauthenticated remote code execution.,9.8,,0.66,0.98,2026-01-29,Ivanti,Endpoint Manager Mobile (EPMM),1,1,[],2026-03-20 01:05:35.382095,2026-04-06 20:51:34.424313
47,CVE-2026-24858,"An Authentication Bypass Using an Alternate Path or Channel vulnerability [CWE-288] vulnerability in Fortinet FortiAnalyzer 7.6.0 through 7.6.5, FortiAnalyzer 7.4.0 through 7.4.9, FortiAnalyzer 7.2.0 through 7.2.11, FortiAnalyzer 7.0.0 through 7.0.15, FortiManager 7.6.0 through 7.6.5, FortiManager 7.4.0 through 7.4.9, FortiManager 7.2.0 through 7.2.11, FortiManager 7.0.0 through 7.0.15, FortiOS 7.6.0 through 7.6.5, FortiOS 7.4.0 through 7.4.10, FortiOS 7.2.0 through 7.2.12, FortiOS 7.0.0 through",9.8,,0.03,0.87,2026-01-27,Fortinet,Multiple Products,1,1,[],2026-03-20 01:05:35.383314,2026-04-06 20:51:34.426572
48,CVE-2018-14634,"An integer overflow flaw was found in the Linux kernel's create_elf_tables() function. An unprivileged local user with access to SUID (or otherwise privileged) binary could use this flaw to escalate their privileges on the system. Kernel versions 2.6.x, 3.10.x and 4.14.x are believed to be vulnerable.",7.8,,0.25,0.96,2018-09-25,Linux,Kernel,1,1,[],2026-03-20 01:05:35.384540,2026-03-21 23:21:53.776344
49,CVE-2025-52691,"Successful exploitation of the vulnerability could allow an unauthenticated attacker to upload arbitrary files to any location on the mail server, potentially enabling remote code execution.",10,,0.8,0.99,2025-12-29,SmarterTools,SmarterMail,1,1,[],2026-03-20 01:05:35.385582,2026-03-21 22:57:00.380013
50,CVE-2026-23760,"SmarterTools SmarterMail versions prior to build 9511 contain an authentication bypass vulnerability in the password reset API. The force-reset-password endpoint permits anonymous requests and fails to verify the existing password or a reset token when resetting system administrator accounts. An unauthenticated attacker can supply a target administrator username and a new password to reset the account, resulting in full administrative compromise of the SmarterMail instance. NOTE: SmarterMail sys",9.8,,0.64,0.98,2026-01-22,SmarterTools,SmarterMail,1,1,[],2026-03-20 01:05:35.386545,2026-03-21 23:05:34.917192
51,CVE-2026-24061,"telnetd in GNU Inetutils through 2.7 allows remote authentication bypass via a ""-f root"" value for the USER environment variable.",9.8,,0.78,0.99,2026-01-21,GNU,InetUtils,1,1,[],2026-03-20 01:05:35.387494,2026-03-21 22:57:37.488487
52,CVE-2026-21509,Reliance on untrusted inputs in a security decision in Microsoft Office allows an unauthorized attacker to bypass a security feature locally.,7.8,,0.09,0.93,2026-01-26,Microsoft,Office,1,1,[],2026-03-20 01:05:35.388443,2026-04-06 20:51:34.428889
53,CVE-2024-37079,vCenter Server contains a heap-overflow vulnerability in the implementation of the DCERPC protocol. A malicious actor with network access to vCenter Server may trigger this vulnerability by sending a specially crafted network packet potentially leading to remote code execution.,9.8,,0.82,0.99,2026-01-23,Broadcom,VMware vCenter Server,1,1,[],2026-03-20 01:05:35.389300,2026-04-06 20:51:34.431009
54,CVE-2025-68645,"A Local File Inclusion (LFI) vulnerability exists in the Webmail Classic UI of Zimbra Collaboration (ZCS) 10.0 and 10.1 because of improper handling of user-supplied request parameters in the RestFilter servlet. An unauthenticated remote attacker can craft requests to the /h/rest endpoint to influence internal request dispatching, allowing inclusion of arbitrary files from the WebRoot directory.",8.8,,0.31,0.97,2025-12-22,Synacor, Zimbra Collaboration Suite (ZCS),1,1,[],2026-03-20 01:05:35.390352,2026-03-21 23:18:42.030725
55,CVE-2025-34026,"The Versa Concerto SD-WAN orchestration platform is vulnerable to an authentication bypass in the Traefik reverse proxy configuration, allowing at attacker to access administrative endpoints. The internal Actuator endpoint can be leveraged for access to heap dumps and trace logs.This issue is known to affect Concerto from 12.1.2 through 12.2.0. Additional versions may be vulnerable.",7.5,,0.62,0.98,2025-05-21,Versa,Concerto,1,1,[],2026-03-20 01:05:35.391546,2026-03-21 23:06:05.984064
56,CVE-2025-31125,"Vite is a frontend tooling framework for javascript. Vite exposes content of non-allowed files using ?inline&import or ?raw?import. Only apps explicitly exposing the Vite dev server to the network (using --host or server.host config option) are affected. This vulnerability is fixed in 6.2.4, 6.1.3, 6.0.13, 5.4.16, and 4.5.11.",5.3,,0.74,0.99,2025-03-31,Vite,Vitejs,1,1,[],2026-03-20 01:05:35.393432,2026-03-21 22:59:48.059893
57,CVE-2025-54313,"eslint-config-prettier 8.10.1, 9.1.1, 10.1.6, and 10.1.7 has embedded malicious code for a supply chain compromise. Installing an affected package executes an install.js file that launches the node-gyp.dll malware on Windows.",7.5,,0.06,0.91,2025-07-19,Prettier,eslint-config-prettier,1,1,[],2026-03-20 01:05:35.394523,2026-03-21 23:34:56.576703
58,CVE-2026-20045,"A vulnerability in Cisco Unified Communications Manager (Unified CM), Cisco Unified Communications Manager Session Management Edition (Unified CM SME), Cisco Unified Communications Manager IM &amp; Presence Service (Unified CM IM&amp;P), Cisco Unity Connection, and Cisco Webex Calling Dedicated Instance could allow an unauthenticated, remote attacker to execute arbitrary commands on the underlying operating system of an affected device.&nbsp;

This vulnerability is due to improper validation o",8.2,,0.01,0.77,2026-01-21,Cisco,Unified Communications Manager,1,1,[],2026-03-20 01:05:35.395492,2026-04-06 20:51:34.432935
59,CVE-2026-20805,Exposure of sensitive information to an unauthorized actor in Desktop Windows Manager allows an authorized attacker to disclose information locally.,5.5,,0.04,0.89,2026-01-13,Microsoft,Windows,1,1,[],2026-03-20 01:05:35.396427,2026-04-06 20:51:34.435014
60,CVE-2025-8110,Improper Symbolic link handling in the PutContents API in Gogs allows Local Execution of Code.,8.8,,0.21,0.96,2025-12-10,Gogs,Gogs,1,1,[],2026-03-20 01:05:35.397350,2026-03-21 23:23:57.735500
61,CVE-2009-0556,"Microsoft Office PowerPoint 2000 SP3, 2002 SP3, and 2003 SP3, and PowerPoint in Microsoft Office 2004 for Mac, allows remote attackers to execute arbitrary code via a PowerPoint file with an OutlineTextRefAtom containing an an invalid index value that triggers memory corruption, as exploited in the wild in April 2009 by Exploit:Win32/Apptom.gen, aka ""Memory Corruption Vulnerability.""",8.8,,0.78,0.99,2026-01-07,Microsoft,Office,1,1,[],2026-03-20 01:05:35.398272,2026-04-06 20:51:34.437046
62,CVE-2025-37164,A remote code execution issue exists in HPE OneView.,10,,0.86,0.99,2025-12-16,Hewlett Packard Enterprise (HPE),OneView,1,1,[],2026-03-20 01:05:35.399184,2026-03-21 22:50:35.142244
63,CVE-2025-14847,"Mismatched length fields in Zlib compressed protocol headers may allow a read of uninitialized heap memory by an unauthenticated client. This issue affects all MongoDB Server v7.0 prior to 7.0.28 versions, MongoDB Server v8.0 versions prior to 8.0.17, MongoDB Server v8.2 versions prior to 8.2.3, MongoDB Server v6.0 versions prior to 6.0.27, MongoDB Server v5.0 versions prior to 5.0.32, MongoDB Server v4.4 versions prior to 4.4.30, MongoDB Server v4.2 versions greater than or equal to 4.2.0, Mong",7.5,,0.74,0.99,2025-12-29,MongoDB,MongoDB and MongoDB Server,1,1,[],2026-03-20 01:05:35.400087,2026-04-06 20:51:34.439126
