id,cve_id,description,cvss_score,cvss_vector,epss_score,epss_percentile,published,vendor,product,is_in_kev,is_in_nist,references,created_at,updated_at
787,CVE-2016-5198,"V8 in Google Chrome prior to 54.0.2840.90 for Linux, and 54.0.2840.85 for Android, and 54.0.2840.87 for Windows and Mac included incorrect optimisation assumptions, which allowed a remote attacker to perform arbitrary read/write operations, leading to code execution, via a crafted HTML page.",8.8,,0.78,0.99,2022-06-08,Google,Chromium V8,1,1,[],2026-03-20 01:05:36.132576,2026-04-06 20:51:35.157140
788,CVE-2016-1646,"The Array.prototype.concat implementation in builtins.cc in Google V8, as used in Google Chrome before 49.0.2623.108, does not properly consider element data types, which allows remote attackers to cause a denial of service (out-of-bounds read) or possibly have unspecified other impact via crafted JavaScript code.",8.8,,0.67,0.99,2022-06-08,Google,Chromium V8,1,1,[],2026-03-20 01:05:36.133581,2026-04-06 20:51:35.159552
789,CVE-2013-1331,"Buffer overflow in Microsoft Office 2003 SP3 and Office 2011 for Mac allows remote attackers to execute arbitrary code via crafted PNG data in an Office document, leading to improper memory allocation, aka ""Office Buffer Overflow Vulnerability.""",7.8,,0.89,1,2022-06-08,Microsoft,Office,1,1,[],2026-03-20 01:05:36.134757,2026-04-06 20:51:35.161705
790,CVE-2012-5054,Adobe Flash Player contains an integer overflow vulnerability that allows remote attackers to execute code via malformed arguments.,8.8,CVSS:3.1/AV:N/AC:L/PR:N/UI:R/S:U/C:H/I:H/A:H,0.77,0.99,2022-06-08,Adobe,Flash Player,1,1,[],2026-03-20 01:05:36.135613,2026-04-06 20:51:35.163697
791,CVE-2012-4969,"Use-after-free vulnerability in the CMshtmlEd::Exec function in mshtml.dll in Microsoft Internet Explorer 6 through 9 allows remote attackers to execute arbitrary code via a crafted web site, as exploited in the wild in September 2012.",8.1,CVSS:3.1/AV:N/AC:H/PR:N/UI:N/S:U/C:H/I:H/A:H,0.92,1,2022-06-08,Microsoft,Internet Explorer,1,1,[],2026-03-20 01:05:36.136471,2026-04-06 20:51:35.165739
792,CVE-2012-1889,"Microsoft XML Core Services 3.0, 4.0, 5.0, and 6.0 accesses uninitialized memory locations, which allows remote attackers to execute arbitrary code or cause a denial of service (memory corruption) via a crafted web site.",8.8,,0.93,1,2022-06-08,Microsoft,XML Core Services,1,1,[],2026-03-20 01:05:36.137420,2026-04-06 20:51:35.167864
793,CVE-2012-0767,"Cross-site scripting (XSS) vulnerability in Adobe Flash Player before 10.3.183.15 and 11.x before 11.1.102.62 on Windows, Mac OS X, Linux, and Solaris; before 11.1.111.6 on Android 2.x and 3.x; and before 11.1.115.6 on Android 4.x allows remote attackers to inject arbitrary web script or HTML via unspecified vectors, aka ""Universal XSS (UXSS),"" as exploited in the wild in February 2012.",6.1,CVSS:3.1/AV:N/AC:L/PR:N/UI:R/S:C/C:L/I:L/A:N,0.16,0.95,2022-06-08,Adobe,Flash Player,1,1,[],2026-03-20 01:05:36.138390,2026-04-06 20:51:35.169993
794,CVE-2012-0754,"Adobe Flash Player before 10.3.183.15 and 11.x before 11.1.102.62 on Windows, Mac OS X, Linux, and Solaris; before 11.1.111.6 on Android 2.x and 3.x; and before 11.1.115.6 on Android 4.x allows attackers to execute arbitrary code or cause a denial of service (memory corruption) via unspecified vectors.",8.1,,0.92,1,2022-06-08,Adobe,Flash Player,1,1,[],2026-03-20 01:05:36.139395,2026-04-06 20:51:35.172138
795,CVE-2012-0151,"The Authenticode Signature Verification function in Microsoft Windows XP SP2 and SP3, Windows Server 2003 SP2, Windows Vista SP2, Windows Server 2008 SP2, R2, and R2 SP1, Windows 7 Gold and SP1, and Windows 8 Consumer Preview does not properly validate the digest of a signed portable executable (PE) file, which allows user-assisted remote attackers to execute arbitrary code via a modified file with additional content, aka ""WinVerifyTrust Signature Validation Vulnerability.""",7.8,CVSS:3.1/AV:L/AC:L/PR:N/UI:R/S:U/C:H/I:H/A:H,0.89,1,2022-06-08,Microsoft,Windows,1,1,[],2026-03-20 01:05:36.140378,2026-04-06 20:51:35.174275
796,CVE-2011-2462,"Unspecified vulnerability in the U3D component in Adobe Reader and Acrobat 10.1.1 and earlier on Windows and Mac OS X, and Adobe Reader 9.x through 9.4.6 on UNIX, allows remote attackers to execute arbitrary code or cause a denial of service (memory corruption) via unknown vectors, as exploited in the wild in December 2011.",9.8,CVSS:3.1/AV:N/AC:L/PR:N/UI:N/S:U/C:H/I:H/A:H,0.92,1,2022-06-08,Adobe,Reader and Acrobat,1,1,[],2026-03-20 01:05:36.141472,2026-04-06 20:51:35.176375
797,CVE-2011-0609,Adobe Flash Player contains an unspecified vulnerability that allows remote attackers to execute code or cause denial-of-service (DoS).,7.8,CVSS:3.1/AV:L/AC:L/PR:N/UI:R/S:U/C:H/I:H/A:H,0.92,1,2022-06-08,Adobe,Flash Player,1,1,[],2026-03-20 01:05:36.142439,2026-04-06 20:51:35.178437
798,CVE-2010-2883,"Stack-based buffer overflow in CoolType.dll in Adobe Reader and Acrobat 9.x before 9.4, and 8.x before 8.2.5 on Windows and Mac OS X, allows remote attackers to execute arbitrary code or cause a denial of service (application crash) via a PDF document with a long field in a Smart INdependent Glyphlets (SING) table in a TTF font, as exploited in the wild in September 2010. NOTE: some of these details are obtained from third party information.",7.3,CVSS:3.1/AV:L/AC:L/PR:L/UI:R/S:U/C:H/I:H/A:H,0.93,1,2022-06-08,Adobe,Acrobat and Reader,1,1,[],2026-03-20 01:05:36.143402,2026-04-06 20:51:35.180489
799,CVE-2010-2572,"Buffer overflow in Microsoft PowerPoint 2002 SP3 and 2003 SP3 allows remote attackers to execute arbitrary code via a crafted PowerPoint 95 document, aka ""PowerPoint Parsing Buffer Overflow Vulnerability.""",7.8,,0.75,0.99,2022-06-08,Microsoft,PowerPoint,1,1,[],2026-03-20 01:05:36.144467,2026-04-06 20:51:35.182251
800,CVE-2010-1297,"Adobe Flash Player before 9.0.277.0 and 10.x before 10.1.53.64; Adobe AIR before 2.0.2.12610; and Adobe Reader and Acrobat 9.x before 9.3.3, and 8.x before 8.2.3 on Windows and Mac OS X, allow remote attackers to execute arbitrary code or cause a denial of service (memory corruption) via crafted SWF content, related to authplay.dll and the ActionScript Virtual Machine 2 (AVM2) newfunction instruction, as exploited in the wild in June 2010.",7.8,CVSS:3.1/AV:L/AC:L/PR:N/UI:R/S:U/C:H/I:H/A:H,0.93,1,2022-06-08,Adobe,Flash Player,1,1,[],2026-03-20 01:05:36.145421,2026-04-06 20:51:35.184350
801,CVE-2009-4324,Use-after-free vulnerability in Adobe Acrobat and Reader allows remote attackers to execute code via a crafted PDF file.,7.8,CVSS:3.1/AV:L/AC:L/PR:N/UI:R/S:U/C:H/I:H/A:H,0.93,1,2022-06-08,Adobe,Acrobat and Reader,1,1,[],2026-03-20 01:05:36.146380,2026-04-06 20:51:35.186423
802,CVE-2009-3953,"The U3D implementation in Adobe Reader and Acrobat 9.x before 9.3, 8.x before 8.2 on Windows and Mac OS X, and 7.x before 7.1.4 allows remote attackers to execute arbitrary code via malformed U3D data in a PDF document, related to a CLODProgressiveMeshDeclaration ""array boundary issue,"" a different vulnerability than CVE-2009-2994.",8.8,CVSS:3.1/AV:N/AC:L/PR:N/UI:R/S:U/C:H/I:H/A:H,0.91,1,2022-06-08,Adobe,Acrobat and Reader,1,1,[],2026-03-20 01:05:36.147333,2026-04-06 20:51:35.188503
803,CVE-2009-1862,"Unspecified vulnerability in Adobe Reader and Acrobat 9.x through 9.1.2, and Adobe Flash Player 9.x through 9.0.159.0 and 10.x through 10.0.22.87, allows remote attackers to execute arbitrary code or cause a denial of service (memory corruption) via (1) a crafted Flash application in a .pdf file or (2) a crafted .swf file, related to authplay.dll, as exploited in the wild in July 2009.",7.8,,0.59,0.98,2022-06-08,Adobe,"Acrobat and Reader, Flash Player",1,1,[],2026-03-20 01:05:36.148278,2026-04-06 20:51:35.190427
804,CVE-2009-0563,"Stack-based buffer overflow in Microsoft Office Word 2002 SP3, 2003 SP3, and 2007 SP1 and SP2; Microsoft Office for Mac 2004 and 2008; Open XML File Format Converter for Mac; Microsoft Office Word Viewer 2003 SP3; Microsoft Office Word Viewer; and Microsoft Office Compatibility Pack for Word, Excel, and PowerPoint 2007 File Formats SP1 and SP2 allows remote attackers to execute arbitrary code via a Word document with a crafted tag containing an invalid length field, aka ""Word Buffer Overflow Vul",7.8,CVSS:3.1/AV:L/AC:L/PR:N/UI:R/S:U/C:H/I:H/A:H,0.8,0.99,2022-06-08,Microsoft,Office,1,1,[],2026-03-20 01:05:36.149472,2026-04-06 20:51:35.192552
805,CVE-2009-0557,"Excel in Microsoft Office 2000 SP3, Office XP SP3, Office 2003 SP3, and Office 2004 and 2008 for Mac; Excel in 2007 Microsoft Office System SP1 and SP2; Open XML File Format Converter for Mac; Microsoft Office Excel Viewer 2003 SP3; Microsoft Office Excel Viewer; and Microsoft Office Compatibility Pack for Word, Excel, and PowerPoint 2007 File Formats SP1 and SP2 allow remote attackers to execute arbitrary code via a crafted Excel file with a malformed record object, aka ""Object Record Corruptio",7.8,,0.86,0.99,2022-06-08,Microsoft,Office,1,1,[],2026-03-20 01:05:36.150431,2026-04-06 20:51:35.194430
806,CVE-2008-0655,Multiple unspecified vulnerabilities in Adobe Reader and Acrobat before 8.1.2 have unknown impact and attack vectors.,9.8,CVSS:3.1/AV:N/AC:L/PR:N/UI:N/S:U/C:H/I:H/A:H,0.69,0.99,2022-06-08,Adobe,Acrobat and Reader,1,1,[],2026-03-20 01:05:36.151851,2026-04-06 20:51:35.196255
807,CVE-2007-5659,Adobe Acrobat and Reader contain a buffer overflow vulnerability that allows remote attackers to execute code via a PDF file with long arguments to unspecified JavaScript methods.,7.8,CVSS:3.1/AV:L/AC:L/PR:N/UI:R/S:U/C:H/I:H/A:H,0.93,1,2022-06-08,Adobe,Acrobat and Reader,1,1,[],2026-03-20 01:05:36.153016,2026-04-06 20:51:35.197921
808,CVE-2006-2492,"Buffer overflow in Microsoft Word in Office 2000 SP3, Office XP SP3, Office 2003 Sp1 and SP2, and Microsoft Works Suites through 2006, allows user-assisted attackers to execute arbitrary code via a malformed object pointer, as originally reported by ISC on 20060519 for a zero-day attack.",8.8,CVSS:3.1/AV:N/AC:L/PR:N/UI:R/S:U/C:H/I:H/A:H,0.83,0.99,2022-06-08,Microsoft,Word,1,1,[],2026-03-20 01:05:36.154109,2026-04-06 20:51:35.199716
809,CVE-2022-26134,"In affected versions of Confluence Server and Data Center, an OGNL injection vulnerability exists that would allow an unauthenticated attacker to execute arbitrary code on a Confluence Server or Data Center instance. The affected versions are from 1.3.0 before 7.4.17, from 7.13.0 before 7.13.7, from 7.14.0 before 7.14.3, from 7.15.0 before 7.15.2, from 7.16.0 before 7.16.4, from 7.17.0 before 7.17.4, and from 7.18.0 before 7.18.1.",9.8,,0.94,1,2022-06-02,Atlassian,Confluence Server/Data Center,1,1,"[""https://github.com/crowsec-edtech/CVE-2022-26134""]",2026-03-20 01:05:36.155242,2026-04-06 20:51:35.201518
810,CVE-2019-3010,"Vulnerability in the Oracle Solaris product of Oracle Systems (component: XScreenSaver). The supported version that is affected is 11. Easily exploitable vulnerability allows low privileged attacker with logon to the infrastructure where Oracle Solaris executes to compromise Oracle Solaris. While the vulnerability is in Oracle Solaris, attacks may significantly impact additional products. Successful attacks of this vulnerability can result in takeover of Oracle Solaris. CVSS 3.0 Base Score 8.8 (",8.8,,0.47,0.98,2022-05-25,Oracle,Solaris,1,1,[],2026-03-20 01:05:36.156252,2026-04-06 20:51:35.203302
811,CVE-2016-3393,"Graphics Device Interface (aka GDI or GDI+) in Microsoft Windows Vista SP2; Windows Server 2008 SP2 and R2 SP1; Windows 7 SP1; Windows 8.1; Windows Server 2012 Gold and R2; Windows RT 8.1; and Windows 10 Gold, 1511, and 1607 allows remote attackers to execute arbitrary code via a crafted web site, aka ""Windows Graphics Component RCE Vulnerability.""",7.8,CVSS:3.1/AV:L/AC:L/PR:N/UI:R/S:U/C:H/I:H/A:H,0.41,0.97,2022-05-25,Microsoft,Windows,1,1,[],2026-03-20 01:05:36.157247,2026-04-06 20:51:35.205091
812,CVE-2016-7256,"atmfd.dll in the Windows font library in Microsoft Windows Vista SP2, Windows Server 2008 SP2 and R2 SP1, Windows 7 SP1, Windows 8.1, Windows Server 2012 Gold and R2, Windows RT 8.1, Windows 10 Gold, 1511, and 1607, and Windows Server 2016 allows remote attackers to execute arbitrary code via a crafted web site, aka ""Open Type Font Remote Code Execution Vulnerability.""",8.8,,0.65,0.98,2022-05-25,Microsoft,Windows,1,1,[],2026-03-20 01:05:36.158257,2026-04-06 20:51:35.206905
813,CVE-2016-1010,"Integer overflow in Adobe Flash Player before 18.0.0.333 and 19.x through 21.x before 21.0.0.182 on Windows and OS X and before 11.2.202.577 on Linux, Adobe AIR before 21.0.0.176, Adobe AIR SDK before 21.0.0.176, and Adobe AIR SDK & Compiler before 21.0.0.176 allows attackers to execute arbitrary code via unspecified vectors, a different vulnerability than CVE-2016-0963 and CVE-2016-0993.",8.8,CVSS:3.1/AV:N/AC:L/PR:N/UI:R/S:U/C:H/I:H/A:H,0.3,0.97,2022-05-25,Adobe,Flash Player and AIR,1,1,[],2026-03-20 01:05:36.159251,2026-04-06 20:51:35.209101
814,CVE-2016-0984,"Use-after-free vulnerability in Adobe Flash Player before 18.0.0.329 and 19.x and 20.x before 20.0.0.306 on Windows and OS X and before 11.2.202.569 on Linux, Adobe AIR before 20.0.0.260, Adobe AIR SDK before 20.0.0.260, and Adobe AIR SDK & Compiler before 20.0.0.260 allows attackers to execute arbitrary code via unspecified vectors, a different vulnerability than CVE-2016-0973, CVE-2016-0974, CVE-2016-0975, CVE-2016-0982, and CVE-2016-0983.",8.8,,0.76,0.99,2022-05-25,Adobe,Flash Player and AIR,1,1,[],2026-03-20 01:05:36.160189,2026-04-06 20:51:35.211275
815,CVE-2016-0034,"Microsoft Silverlight 5 before 5.1.41212.0 mishandles negative offsets during decoding, which allows remote attackers to execute arbitrary code or cause a denial of service (object-header corruption) via a crafted web site, aka ""Silverlight Runtime Remote Code Execution Vulnerability.""",8.8,,0.41,0.97,2022-05-25,Microsoft,Silverlight,1,1,[],2026-03-20 01:05:36.161232,2026-04-06 20:51:35.213268
816,CVE-2015-0310,"Adobe Flash Player before 13.0.0.262 and 14.x through 16.x before 16.0.0.287 on Windows and OS X and before 11.2.202.438 on Linux does not properly restrict discovery of memory addresses, which allows attackers to bypass the ASLR protection mechanism on Windows, and have an unspecified impact on other platforms, via unknown vectors, as exploited in the wild in January 2015.",7.8,,0.05,0.9,2022-05-25,Adobe,Flash Player,1,1,[],2026-03-20 01:05:36.162236,2026-04-06 20:51:35.215297
817,CVE-2015-0016,"Directory traversal vulnerability in the TS WebProxy (aka TSWbPrxy) component in Microsoft Windows Vista SP2, Windows 7 SP1, Windows Server 2008 R2 SP1, Windows 8, Windows 8.1, Windows Server 2012 Gold and R2, and Windows RT Gold and 8.1 allows remote attackers to gain privileges via a crafted pathname in an executable file, as demonstrated by a transition from Low Integrity to Medium Integrity, aka ""Directory Traversal Elevation of Privilege Vulnerability.""",7.8,,0.92,1,2022-05-25,Microsoft,Windows,1,1,[],2026-03-20 01:05:36.163232,2026-04-06 20:51:35.217387
818,CVE-2015-0071,"Microsoft Internet Explorer 9 through 11 allows remote attackers to bypass the ASLR protection mechanism via a crafted web site, aka ""Internet Explorer ASLR Bypass Vulnerability.""",6.5,CVSS:3.1/AV:N/AC:L/PR:N/UI:R/S:U/C:N/I:H/A:N,0.37,0.97,2022-05-25,Microsoft,Internet Explorer,1,1,[],2026-03-20 01:05:36.164234,2026-04-06 20:51:35.219492
819,CVE-2015-2360,"win32k.sys in the kernel-mode drivers in Microsoft Windows Server 2003 SP2 and R2 SP2, Windows Vista SP2, Windows Server 2008 SP2 and R2 SP1, Windows 7 SP1, Windows 8, Windows 8.1, Windows Server 2012 Gold and R2, and Windows RT Gold and 8.1 allows local users to gain privileges or cause a denial of service (memory corruption) via a crafted application, aka ""Win32k Elevation of Privilege Vulnerability.""",8.8,,0.13,0.94,2022-05-25,Microsoft,Win32k,1,1,[],2026-03-20 01:05:36.165541,2026-04-06 20:51:35.222191
820,CVE-2015-2425,"Microsoft Internet Explorer 11 allows remote attackers to execute arbitrary code or cause a denial of service (memory corruption) via a crafted web site, aka ""Internet Explorer Memory Corruption Vulnerability,"" a different vulnerability than CVE-2015-2383 and CVE-2015-2384.",8.8,,0.34,0.97,2022-05-25,Microsoft,Internet Explorer,1,1,[],2026-03-20 01:05:36.166589,2026-04-06 20:51:35.224476
821,CVE-2015-1769,"Mount Manager in Microsoft Windows Vista SP2, Windows Server 2008 SP2 and R2 SP1, Windows 7 SP1, Windows 8, Windows 8.1, Windows Server 2012 Gold and R2, Windows RT Gold and 8.1, and Windows 10 mishandles symlinks, which allows physically proximate attackers to execute arbitrary code by connecting a crafted USB device, aka ""Mount Manager Elevation of Privilege Vulnerability.""",6.6,,0.32,0.97,2022-05-25,Microsoft,Windows,1,1,[],2026-03-20 01:05:36.167482,2026-04-06 20:51:35.226759
822,CVE-2015-4495,"The PDF reader in Mozilla Firefox before 39.0.3, Firefox ESR 38.x before 38.1.1, and Firefox OS before 2.2 allows remote attackers to bypass the Same Origin Policy, and read arbitrary files or gain privileges, via vectors involving crafted JavaScript code and a native setter, as exploited in the wild in August 2015.",8.8,,0.72,0.99,2022-05-25,Mozilla,Firefox,1,1,[],2026-03-20 01:05:36.168474,2026-04-06 20:51:35.229153
823,CVE-2015-8651,"Integer overflow in Adobe Flash Player before 18.0.0.324 and 19.x and 20.x before 20.0.0.267 on Windows and OS X and before 11.2.202.559 on Linux, Adobe AIR before 20.0.0.233, Adobe AIR SDK before 20.0.0.233, and Adobe AIR SDK & Compiler before 20.0.0.233 allows attackers to execute arbitrary code via unspecified vectors.",8.8,,0.89,1,2022-05-25,Adobe,Flash Player,1,1,[],2026-03-20 01:05:36.169467,2026-04-06 20:51:35.231277
824,CVE-2015-6175,"The kernel in Microsoft Windows 10 Gold allows local users to gain privileges via a crafted application, aka ""Windows Kernel Memory Elevation of Privilege Vulnerability.""",7.8,,0.03,0.86,2022-05-25,Microsoft,Windows,1,1,[],2026-03-20 01:05:36.170478,2026-04-06 20:51:35.233425
825,CVE-2015-1671,"The Windows DirectWrite library, as used in Microsoft .NET Framework 3.0 SP2, 3.5, 3.5.1, 4, 4.5, 4.5.1, and 4.5.2; Office 2007 SP3 and 2010 SP2; Live Meeting 2007 Console; Lync 2010; Lync 2010 Attendee; Lync 2013 SP1; Lync Basic 2013 SP1; Silverlight 5 before 5.1.40416.00; and Silverlight 5 Developer Runtime before 5.1.40416.00, allows remote attackers to execute arbitrary code via a crafted TrueType font, aka ""TrueType Font Parsing Vulnerability.""",7.8,CVSS:3.1/AV:L/AC:L/PR:N/UI:R/S:U/C:H/I:H/A:H,0.86,0.99,2022-05-25,Microsoft,Windows,1,1,[],2026-03-20 01:05:36.171498,2026-04-06 20:51:35.235672
826,CVE-2014-4148,"win32k.sys in the kernel-mode drivers in Microsoft Windows Server 2003 SP2, Windows Vista SP2, Windows Server 2008 SP2 and R2 SP1, Windows 7 SP1, Windows 8, Windows 8.1, Windows Server 2012 Gold and R2, and Windows RT Gold and 8.1 allows remote attackers to execute arbitrary code via a crafted TrueType font, as exploited in the wild in October 2014, aka ""TrueType Font Parsing Remote Code Execution Vulnerability.""",8.8,CVSS:3.1/AV:N/AC:L/PR:N/UI:R/S:U/C:H/I:H/A:H,0.53,0.98,2022-05-25,Microsoft,Windows,1,1,[],2026-03-20 01:05:36.172501,2026-04-06 20:51:35.237580
827,CVE-2014-8439,"Adobe Flash Player before 13.0.0.258 and 14.x and 15.x before 15.0.0.239 on Windows and OS X and before 11.2.202.424 on Linux, Adobe AIR before 15.0.0.293, Adobe AIR SDK before 15.0.0.302, and Adobe AIR SDK & Compiler before 15.0.0.302 allow attackers to execute arbitrary code or cause a denial of service (invalid pointer dereference) via unspecified vectors.",8.8,,0.27,0.96,2022-05-25,Adobe,Flash Player,1,1,[],2026-03-20 01:05:36.173472,2026-04-06 20:51:35.239751
828,CVE-2014-4123,"Microsoft Internet Explorer 7 through 11 allows remote attackers to gain privileges via a crafted web site, aka ""Internet Explorer Elevation of Privilege Vulnerability,"" as exploited in the wild in October 2014, a different vulnerability than CVE-2014-4124.",8.8,,0.54,0.98,2022-05-25,Microsoft,Internet Explorer,1,1,[],2026-03-20 01:05:36.174421,2026-04-06 20:51:35.241896
829,CVE-2014-0546,"Adobe Reader and Acrobat 10.x before 10.1.11 and 11.x before 11.0.08 on Windows allow attackers to bypass a sandbox protection mechanism, and consequently execute native code in a privileged context, via unspecified vectors.",9.8,CVSS:3.1/AV:N/AC:L/PR:N/UI:N/S:U/C:H/I:H/A:H,0.3,0.97,2022-05-25,Adobe,Reader and Acrobat,1,1,[],2026-03-20 01:05:36.175788,2026-04-06 20:51:35.243998
830,CVE-2014-2817,"Microsoft Internet Explorer 6 through 11 allows remote attackers to gain privileges via a crafted web site, aka ""Internet Explorer Elevation of Privilege Vulnerability.""",8.8,,0.26,0.96,2022-05-25,Microsoft,Internet Explorer,1,1,[],2026-03-20 01:05:36.177170,2026-04-06 20:51:35.246322
831,CVE-2014-4077,"Microsoft Windows Server 2003 SP2, Windows Vista SP2, Windows Server 2008 SP2 and R2 SP1, Windows 7 SP1, and Office 2007 SP3, when IMJPDCT.EXE (aka IME for Japanese) is installed, allow remote attackers to bypass a sandbox protection mechanism via a crafted PDF document, aka ""Microsoft IME (Japanese) Elevation of Privilege Vulnerability,"" as exploited in the wild in 2014.",7.8,,0.34,0.97,2022-05-25,Microsoft,Input Method Editor (IME) Japanese,1,1,[],2026-03-20 01:05:36.178508,2026-04-06 20:51:35.248239
832,CVE-2014-3153,"The futex_requeue function in kernel/futex.c in the Linux kernel through 3.14.5 does not ensure that calls have two different futex addresses, which allows local users to gain privileges via a crafted FUTEX_REQUEUE command that facilitates unsafe waiter modification.",7.8,CVSS:3.1/AV:L/AC:L/PR:L/UI:N/S:U/C:H/I:H/A:H,0.69,0.99,2014-06-07,Linux,Kernel,1,1,[],2026-03-20 01:05:36.179663,2026-03-21 21:55:20.467024
833,CVE-2013-7331,"The Microsoft.XMLDOM ActiveX control in Microsoft Windows 8.1 and earlier allows remote attackers to determine the existence of local pathnames, UNC share pathnames, intranet hostnames, and intranet IP addresses by examining error codes, as demonstrated by a res:// URL, and exploited in the wild in February 2014.",6.5,CVSS:3.1/AV:N/AC:L/PR:N/UI:N/S:U/C:L/I:N/A:L,0.82,0.99,2022-05-25,Microsoft,Internet Explorer,1,1,[],2026-03-20 01:05:36.180989,2026-04-06 20:51:35.250519
834,CVE-2013-3993,"IBM InfoSphere BigInsights before 2.1.0.3 allows remote authenticated users to bypass intended file and directory restrictions, or access untrusted data or code, via crafted parameters in unspecified API calls.",6.5,,0.21,0.96,2014-07-07,IBM,InfoSphere BigInsights,1,1,[],2026-03-20 01:05:36.182845,2026-03-21 23:24:03.912770
835,CVE-2013-3896,"Microsoft Silverlight 5 before 5.1.20913.0 does not properly validate pointers during access to Silverlight elements, which allows remote attackers to obtain sensitive information via a crafted Silverlight application, aka ""Silverlight Vulnerability.""",5.5,,0.82,0.99,2022-05-25,Microsoft,Silverlight,1,1,[],2026-03-20 01:05:36.183827,2026-04-06 20:51:35.252799
836,CVE-2013-2423,"Unspecified vulnerability in the Java Runtime Environment (JRE) component in Oracle Java SE 7 Update 17 and earlier, and OpenJDK 7, allows remote attackers to affect integrity via unknown vectors related to HotSpot.  NOTE: the previous information is from the April 2013 CPU. Oracle has not commented on claims from the original researcher that this vulnerability allows remote attackers to bypass permission checks by the MethodHandles method and modify arbitrary public final fields using reflectio",3.7,,0.93,1,2022-05-25,Oracle,Java Runtime Environment (JRE),1,1,[],2026-03-20 01:05:36.184768,2026-04-06 20:51:35.255027
837,CVE-2013-0431,"Unspecified vulnerability in the Java Runtime Environment (JRE) component in Oracle Java SE 7 through Update 11, and OpenJDK 7, allows user-assisted remote attackers to bypass the Java security sandbox via unspecified vectors related to JMX, aka ""Issue 52,"" a different vulnerability than CVE-2013-1490.",5.3,,0.92,1,2022-05-25,Oracle,Java Runtime Environment (JRE),1,1,[],2026-03-20 01:05:36.185735,2026-04-06 20:51:35.257389
838,CVE-2013-0422,"Multiple vulnerabilities in Oracle Java 7 before Update 11 allow remote attackers to execute arbitrary code by (1) using the public getMBeanInstantiator method in the JmxMBeanServer class to obtain a reference to a private MBeanInstantiator object, then retrieving arbitrary Class references using the findClass method, and (2) using the Reflection API with recursion in a way that bypasses a security check by the java.lang.invoke.MethodHandles.Lookup.checkSecurityManager method due to the inabilit",9.8,,0.94,1,2022-05-25,Oracle,Java Runtime Environment (JRE),1,1,[],2026-03-20 01:05:36.186697,2026-04-06 20:51:35.259514
839,CVE-2013-0074,"Microsoft Silverlight 5, and 5 Developer Runtime, before 5.1.20125.0 does not properly validate pointers during HTML object rendering, which allows remote attackers to execute arbitrary code via a crafted Silverlight application, aka ""Silverlight Double Dereference Vulnerability.""",7.8,CVSS:3.1/AV:L/AC:L/PR:N/UI:R/S:U/C:H/I:H/A:H,0.93,1,2022-05-25,Microsoft,Silverlight,1,1,[],2026-03-20 01:05:36.187641,2026-04-06 20:51:35.261688
840,CVE-2012-1710,"Unspecified vulnerability in the Oracle WebCenter Forms Recognition component in Oracle Fusion Middleware 10.1.3.5 allows remote attackers to affect confidentiality, integrity, and availability via unknown vectors related to Designer, a different vulnerability than CVE-2012-1709.",9.8,CVSS:3.1/AV:N/AC:L/PR:N/UI:N/S:U/C:H/I:H/A:H,0.55,0.98,2022-05-25,Oracle,Fusion Middleware,1,1,[],2026-03-20 01:05:36.188494,2026-04-06 20:51:35.263863
