id,cve_id,description,cvss_score,cvss_vector,epss_score,epss_percentile,published,vendor,product,is_in_kev,is_in_nist,references,created_at,updated_at
1174,CVE-2018-20250,"In WinRAR versions prior to and including 5.61, There is path traversal vulnerability when crafting the filename field of the ACE format (in UNACEV2.dll). When the filename field is manipulated with specific patterns, the destination (extraction) folder is ignored, thus treating the filename as an absolute path.",7.8,CVSS:3.1/AV:L/AC:L/PR:N/UI:R/S:U/C:H/I:H/A:H,0.93,1,2019-02-05,RARLAB,WinRAR,1,1,[],2026-03-20 01:05:36.524495,2026-03-21 21:53:22.015344
1175,CVE-2018-15982,"Flash Player versions 31.0.0.153 and earlier, and 31.0.0.108 and earlier have a use after free vulnerability. Successful exploitation could lead to arbitrary code execution.",7.8,,0.94,1,2022-02-15,Adobe,Flash Player,1,1,[],2026-03-20 01:05:36.525397,2026-04-06 20:51:35.705412
1176,CVE-2017-9841,"Util/PHP/eval-stdin.php in PHPUnit before 4.8.28 and 5.x before 5.6.3 allows remote attackers to execute arbitrary PHP code via HTTP POST data beginning with a ""<?php "" substring, as demonstrated by an attack on a site with an exposed /vendor folder, i.e., external access to the /vendor/phpunit/phpunit/src/Util/PHP/eval-stdin.php URI.",9.8,,0.94,1,2017-06-27,PHPUnit,PHPUnit,1,1,[],2026-03-20 01:05:36.526266,2026-03-21 22:12:19.093641
1177,CVE-2014-1761,"Microsoft Word 2003 SP3, 2007 SP3, 2010 SP1 and SP2, 2013, and 2013 RT; Word Viewer; Office Compatibility Pack SP3; Office for Mac 2011; Word Automation Services on SharePoint Server 2010 SP1 and SP2 and 2013; Office Web Apps 2010 SP1 and SP2; and Office Web Apps Server 2013 allow remote attackers to execute arbitrary code or cause a denial of service (memory corruption) via crafted RTF data, as exploited in the wild in March 2014.",7.8,,0.93,1,2022-02-15,Microsoft,Word,1,1,[],2026-03-20 01:05:36.527126,2026-04-06 20:51:35.707710
1178,CVE-2013-3906,"GDI+ in Microsoft Windows Vista SP2 and Server 2008 SP2; Office 2003 SP3, 2007 SP3, and 2010 SP1 and SP2; Office Compatibility Pack SP3; and Lync 2010, 2010 Attendee, 2013, and Basic 2013 allows remote attackers to execute arbitrary code via a crafted TIFF image, as demonstrated by an image in a Word document, and exploited in the wild in October and November 2013.",7.8,CVSS:3.1/AV:L/AC:L/PR:N/UI:R/S:U/C:H/I:H/A:H,0.93,1,2022-02-15,Microsoft,Graphics Component,1,1,[],2026-03-20 01:05:36.527993,2026-04-06 20:51:35.709914
1179,CVE-2022-22620,"A use after free issue was addressed with improved memory management. This issue is fixed in macOS Monterey 12.2.1, iOS 15.3.1 and iPadOS 15.3.1, Safari 15.3 (v. 16612.4.9.1.8 and 15612.4.9.1.8). Processing maliciously crafted web content may lead to arbitrary code execution. Apple is aware of a report that this issue may have been actively exploited..",8.8,CVSS:3.1/AV:N/AC:L/PR:N/UI:R/S:U/C:H/I:H/A:H,0.04,0.88,2022-03-18,Apple,"iOS, iPadOS, and macOS",1,1,[],2026-03-20 01:05:36.528858,2026-03-21 21:51:11.198757
1180,CVE-2021-36934,"<p>An elevation of privilege vulnerability exists because of overly permissive Access Control Lists (ACLs) on multiple system files, including the Security Accounts Manager (SAM) database. An attacker who successfully exploited this vulnerability could run arbitrary code with SYSTEM privileges. An attacker could then install programs; view, change, or delete data; or create new accounts with full user rights.</p>
<p>An attacker must have the ability to execute code on a victim system to exploit ",7.8,,0.9,1,2022-02-10,Microsoft,Windows,1,1,[],2026-03-20 01:05:36.529721,2026-04-06 20:51:35.712099
1181,CVE-2020-0796,"A remote code execution vulnerability exists in the way that the Microsoft Server Message Block 3.1.1 (SMBv3) protocol handles certain requests, aka 'Windows SMBv3 Client/Server Remote Code Execution Vulnerability'.",10,,0.94,1,2022-02-10,Microsoft,SMBv3,1,1,[],2026-03-20 01:05:36.530581,2026-04-06 20:51:35.714382
1182,CVE-2018-1000861,"A code execution vulnerability exists in the Stapler web framework used by Jenkins 2.153 and earlier, LTS 2.138.3 and earlier in stapler/core/src/main/java/org/kohsuke/stapler/MetaClass.java that allows attackers to invoke some methods on Java objects by accessing crafted URLs that were not intended to be invoked this way.",9.8,,0.94,1,2018-12-10,Jenkins,Jenkins Stapler Web Framework,1,1,[],2026-03-20 01:05:36.531435,2026-03-21 22:05:48.149017
1183,CVE-2017-9791,The Struts 1 plugin in Apache Struts 2.1.x and 2.3.x might allow remote code execution via a malicious field value passed in a raw message to the ActionMessage.,9.8,CVSS:3.1/AV:N/AC:L/PR:N/UI:N/S:U/C:H/I:H/A:H,0.94,1,2022-02-10,Apache,Struts 1,1,1,[],2026-03-20 01:05:36.532304,2026-04-06 20:51:35.716674
1184,CVE-2017-8464,"Windows Shell in Microsoft Windows Server 2008 SP2 and R2 SP1, Windows 7 SP1, Windows 8, Windows 8.1, Windows Server 2012 Gold and R2, Windows RT 8.1, Windows 10 Gold, 1511, 1607, 1703, and Windows Server 2016 allows local users or remote attackers to execute arbitrary code via a crafted .LNK file, which is not properly handled during icon display in Windows Explorer or any other application that parses the icon of the shortcut. aka ""LNK Remote Code Execution Vulnerability.""",8.8,CVSS:3.1/AV:N/AC:L/PR:N/UI:R/S:U/C:H/I:H/A:H,0.94,1,2022-02-10,Microsoft,Windows,1,1,[],2026-03-20 01:05:36.533197,2026-04-06 20:51:35.718842
1185,CVE-2017-10271,"Vulnerability in the Oracle WebLogic Server component of Oracle Fusion Middleware (subcomponent: WLS Security). Supported versions that are affected are 10.3.6.0.0, 12.1.3.0.0, 12.2.1.1.0 and 12.2.1.2.0. Easily exploitable vulnerability allows unauthenticated attacker with network access via T3 to compromise Oracle WebLogic Server. Successful attacks of this vulnerability can result in takeover of Oracle WebLogic Server. CVSS 3.0 Base Score 7.5 (Availability impacts). CVSS Vector: (CVSS:3.0/AV:N",7.5,,0.94,1,2022-02-10,Oracle,WebLogic Server,1,1,[],2026-03-20 01:05:36.534092,2026-04-06 20:51:35.721082
1186,CVE-2017-0263,"The kernel-mode drivers in Microsoft Windows Server 2008 SP2 and R2 SP1, Windows 7 SP1, Windows 8.1, Windows Server 2012 Gold and R2, Windows RT 8.1, Windows 10 Gold, 1511, 1607, 1703, and Windows Server 2016 allow local users to gain privileges via a crafted application, aka ""Win32k Elevation of Privilege Vulnerability.""",7.8,,0.18,0.95,2022-02-10,Microsoft,Win32k,1,1,[],2026-03-20 01:05:36.535150,2026-04-06 20:51:35.723347
1187,CVE-2017-0262,"Microsoft Office 2010 SP2, Office 2013 SP1, and Office 2016 allow a remote code execution vulnerability when the software fails to properly handle objects in memory, aka ""Office Remote Code Execution Vulnerability"". This CVE ID is unique from CVE-2017-0261 and CVE-2017-0281.",7.8,,0.64,0.98,2022-02-10,Microsoft,Office,1,1,[],2026-03-20 01:05:36.536013,2026-04-06 20:51:35.725598
1188,CVE-2017-0145,"The SMBv1 server in Microsoft Windows Vista SP2; Windows Server 2008 SP2 and R2 SP1; Windows 7 SP1; Windows 8.1; Windows Server 2012 Gold and R2; Windows RT 8.1; and Windows 10 Gold, 1511, and 1607; and Windows Server 2016 allows remote attackers to execute arbitrary code via crafted packets, aka ""Windows SMB Remote Code Execution Vulnerability."" This vulnerability is different from those described in CVE-2017-0143, CVE-2017-0144, CVE-2017-0146, and CVE-2017-0148.",8.8,,0.93,1,2022-02-10,Microsoft,SMBv1,1,1,[],2026-03-20 01:05:36.536898,2026-04-06 20:51:35.727835
1189,CVE-2017-0144,"The SMBv1 server in Microsoft Windows Vista SP2; Windows Server 2008 SP2 and R2 SP1; Windows 7 SP1; Windows 8.1; Windows Server 2012 Gold and R2; Windows RT 8.1; and Windows 10 Gold, 1511, and 1607; and Windows Server 2016 allows remote attackers to execute arbitrary code via crafted packets, aka ""Windows SMB Remote Code Execution Vulnerability."" This vulnerability is different from those described in CVE-2017-0143, CVE-2017-0145, CVE-2017-0146, and CVE-2017-0148.",8.8,,0.94,1,2022-02-10,Microsoft,SMBv1,1,1,[],2026-03-20 01:05:36.537757,2026-04-06 20:51:35.729831
1190,CVE-2016-3088,The Fileserver web application in Apache ActiveMQ 5.x before 5.14.0 allows remote attackers to upload and execute arbitrary files via an HTTP PUT followed by an HTTP MOVE request.,9.8,,0.94,1,2022-02-10,Apache,ActiveMQ,1,1,[],2026-03-20 01:05:36.538624,2026-04-06 20:51:35.732095
1191,CVE-2015-2051,The D-Link DIR-645 Wired/Wireless Router Rev. Ax with firmware 1.04b12 and earlier allows remote attackers to execute arbitrary commands via a GetDeviceSettings action to the HNAP interface.,9.8,,0.93,1,2015-02-23,D-Link,DIR-645 Router,1,1,[],2026-03-20 01:05:36.539481,2026-03-21 22:34:31.669635
1192,CVE-2015-1635,"HTTP.sys in Microsoft Windows 7 SP1, Windows Server 2008 R2 SP1, Windows 8, Windows 8.1, and Windows Server 2012 Gold and R2 allows remote attackers to execute arbitrary code via crafted HTTP requests, aka ""HTTP.sys Remote Code Execution Vulnerability.""",9.8,,0.94,1,2022-02-10,Microsoft,HTTP.sys,1,1,[],2026-03-20 01:05:36.540369,2026-04-06 20:51:35.734411
1193,CVE-2015-1130,The XPC implementation in Admin Framework in Apple OS X before 10.10.3 allows local users to bypass authentication and obtain admin privileges via unspecified vectors.,7.8,,0.21,0.96,2015-04-10,Apple,OS X,1,1,[],2026-03-20 01:05:36.541640,2026-03-21 23:23:51.590365
1194,CVE-2014-4404,Heap-based buffer overflow in IOHIDFamily in Apple iOS before 8 and Apple TV before 7 allows attackers to execute arbitrary code in a privileged context via an application that provides crafted key-mapping properties.,7.8,,0.62,0.98,2014-09-18,Apple,OS X,1,1,[],2026-03-20 01:05:36.542591,2026-03-21 23:06:24.555860
1195,CVE-2022-21882,Win32k Elevation of Privilege Vulnerability,7,,0.89,1,2022-02-04,Microsoft,Win32k,1,1,[],2026-03-20 01:05:36.543554,2026-04-06 20:51:35.736745
1196,CVE-2022-22587,"A memory corruption issue was addressed with improved input validation. This issue is fixed in iOS 15.3 and iPadOS 15.3, macOS Big Sur 11.6.3, macOS Monterey 12.2. A malicious application may be able to execute arbitrary code with kernel privileges. Apple is aware of a report that this issue may have been actively exploited..",9.8,,0,0.61,2022-03-18,Apple,iOS and macOS,1,1,[],2026-03-20 01:05:36.544522,2026-03-21 23:53:34.906540
1197,CVE-2021-20038,"A Stack-based buffer overflow vulnerability in SMA100 Apache httpd server's mod_cgi module environment variables allows a remote unauthenticated attacker to potentially execute code as a 'nobody' user in the appliance. This vulnerability affected SMA 200, 210, 400, 410 and 500v appliances firmware 10.2.0.8-37sv, 10.2.1.1-19sv, 10.2.1.2-24sv and earlier versions.",9.8,,0.94,1,2021-12-08,SonicWall,SMA 100 Appliances,1,1,[],2026-03-20 01:05:36.545477,2026-03-21 22:11:11.059972
1198,CVE-2020-5722,The HTTP interface of the Grandstream UCM6200 series is vulnerable to an unauthenticated remote SQL injection via crafted HTTP request. An attacker can use this vulnerability to execute shell commands as root on versions before 1.0.19.20 or inject HTML in password recovery emails in versions before 1.0.20.17.,9.8,,0.93,1,2020-03-23,Grandstream,UCM6200,1,1,[],2026-03-20 01:05:36.546422,2026-03-21 22:39:05.362796
1199,CVE-2020-0787,"An elevation of privilege vulnerability exists when the Windows Background Intelligent Transfer Service (BITS) improperly handles symbolic links, aka 'Windows Background Intelligent Transfer Service Elevation of Privilege Vulnerability'.",7.8,CVSS:3.1/AV:L/AC:L/PR:N/UI:R/S:U/C:H/I:H/A:H,0.61,0.98,2022-01-28,Microsoft,Windows,1,1,"[""https://itm4n.github.io/cve-2020-0787-windows-bits-eop/""]",2026-03-20 01:05:36.547374,2026-04-06 20:51:35.739140
1200,CVE-2017-5689,"An unprivileged network attacker could gain system privileges to provisioned Intel manageability SKUs: Intel Active Management Technology (AMT) and Intel Standard Manageability (ISM). An unprivileged local attacker could provision manageability features gaining unprivileged network or local system privileges on Intel manageability SKUs: Intel Active Management Technology (AMT), Intel Standard Manageability (ISM), and Intel Small Business Technology (SBT).",9.8,,0.94,1,2017-05-02,Intel,"Active Management Technology (AMT), Small Business Technology (SBT), and Standard Manageability",1,1,[],2026-03-20 01:05:36.548217,2026-03-21 22:12:25.291808
1201,CVE-2014-1776,"Use-after-free vulnerability in Microsoft Internet Explorer 6 through 11 allows remote attackers to execute arbitrary code or cause a denial of service (memory corruption) via vectors related to the CMarkup::IsConnectedToPrimaryMarkup function, as exploited in the wild in April 2014.  NOTE: this issue originally emphasized VGX.DLL, but Microsoft clarified that ""VGX.DLL does not contain the vulnerable code leveraged in this exploit. Disabling VGX.DLL is an exploit-specific workaround that provide",9.8,,0.8,0.99,2022-01-28,Microsoft,Internet Explorer,1,1,[],2026-03-20 01:05:36.549060,2026-04-06 20:51:35.741365
1202,CVE-2014-6271,"GNU Bash through 4.3 processes trailing strings after function definitions in the values of environment variables, which allows remote attackers to execute arbitrary code via a crafted environment, as demonstrated by vectors involving the ForceCommand feature in OpenSSH sshd, the mod_cgi and mod_cgid modules in the Apache HTTP Server, scripts executed by unspecified DHCP clients, and other situations in which setting the environment occurs across a privilege boundary from Bash execution, aka ""Sh",9.8,,0.94,1,2014-09-24,GNU,Bourne-Again Shell (Bash),1,1,[],2026-03-20 01:05:36.550429,2026-03-21 22:13:02.567249
1203,CVE-2014-7169,"GNU Bash through 4.3 bash43-025 processes trailing strings after certain malformed function definitions in the values of environment variables, which allows remote attackers to write to files or possibly have unknown other impact via a crafted environment, as demonstrated by vectors involving the ForceCommand feature in OpenSSH sshd, the mod_cgi and mod_cgid modules in the Apache HTTP Server, scripts executed by unspecified DHCP clients, and other situations in which setting the environment occu",9.8,CVSS:3.1/AV:N/AC:L/PR:N/UI:N/S:U/C:H/I:H/A:H,0.9,1,2014-09-25,GNU,Bourne-Again Shell (Bash),1,1,[],2026-03-20 01:05:36.551589,2026-03-21 21:41:53.437714
1204,CVE-2006-1547,"ActionForm in Apache Software Foundation (ASF) Struts before 1.2.9 with BeanUtils 1.7 allows remote attackers to cause a denial of service via a multipart/form-data encoded form with a parameter name that references the public getMultipartRequestHandler method, which provides further access to elements in the CommonsMultipartRequestHandler implementation and BeanUtils.",7.5,CVSS:3.1/AV:N/AC:L/PR:N/UI:N/S:U/C:N/I:N/A:H,0.15,0.95,2022-01-21,Apache,Struts 1,1,1,[],2026-03-20 01:05:36.552534,2026-04-06 20:51:35.743633
1205,CVE-2012-0391,"The ExceptionDelegator component in Apache Struts before 2.2.3.1 interprets parameter values as OGNL expressions during certain exception handling for mismatched data types of properties, which allows remote attackers to execute arbitrary Java code via a crafted parameter.",9.8,,0.88,0.99,2022-01-21,Apache,Struts 2,1,1,[],2026-03-20 01:05:36.553579,2026-04-06 20:51:35.745838
1206,CVE-2018-8453,"An elevation of privilege vulnerability exists in Windows when the Win32k component fails to properly handle objects in memory, aka ""Win32k Elevation of Privilege Vulnerability."" This affects Windows 7, Windows Server 2012 R2, Windows RT 8.1, Windows Server 2008, Windows Server 2019, Windows Server 2012, Windows 8.1, Windows Server 2016, Windows Server 2008 R2, Windows 10, Windows 10 Servers.",7.8,,0.78,0.99,2022-01-21,Microsoft,Win32k,1,1,[],2026-03-20 01:05:36.554541,2026-04-06 20:51:35.748038
1207,CVE-2021-35247,Serv-U web login screen to LDAP authentication was allowing characters that were not sufficiently sanitized. SolarWinds has updated the input mechanism to perform additional validation and sanitization. Please Note: No downstream affect has been detected as the LDAP servers ignored improper characters. To insure proper input validation is completed in all environments. SolarWinds recommends scheduling an update to the latest version of Serv-U.,4.3,,0.03,0.87,2022-01-21,SolarWinds,Serv-U,1,1,[],2026-03-20 01:05:36.555549,2026-04-06 20:51:35.750067
1208,CVE-2021-32648,octobercms in a CMS platform based on the Laravel PHP Framework. In affected versions of the october/system package an attacker can request an account password reset and then gain access to the account using a specially crafted request. The issue has been patched in Build 472 and v1.1.5.,8.2,,0.93,1,2021-08-26,October CMS,October CMS,1,1,[],2026-03-20 01:05:36.556399,2026-03-21 22:34:44.005140
1209,CVE-2021-25296,"Nagios XI version xi-5.7.5 is affected by OS command injection. The vulnerability exists in the file /usr/local/nagiosxi/html/includes/configwizards/windowswmi/windowswmi.inc.php due to improper sanitization of authenticated user-controlled input by a single HTTP request, which can lead to OS command injection on the Nagios XI server.",8.8,,0.94,1,2021-02-15,Nagios,Nagios XI,1,1,[],2026-03-20 01:05:36.557344,2026-03-22 15:27:10.739599
1210,CVE-2021-25297,"Nagios XI version xi-5.7.5 is affected by OS command injection. The vulnerability exists in the file /usr/local/nagiosxi/html/includes/configwizards/switch/switch.inc.php due to improper sanitization of authenticated user-controlled input by a single HTTP request, which can lead to OS command injection on the Nagios XI server.",8.8,,0.8,0.99,2021-02-15,Nagios,Nagios XI,1,1,[],2026-03-20 01:05:36.558186,2026-03-21 22:57:06.543212
1211,CVE-2021-25298,"Nagios XI version xi-5.7.5 is affected by OS command injection. The vulnerability exists in the file /usr/local/nagiosxi/html/includes/configwizards/cloud-vm/cloud-vm.inc.php due to improper sanitization of authenticated user-controlled input by a single HTTP request, which can lead to OS command injection on the Nagios XI server.",8.8,CVSS:3.1/AV:N/AC:L/PR:L/UI:N/S:U/C:H/I:H/A:H,0.75,0.99,2021-02-15,Nagios,Nagios XI,1,1,[],2026-03-20 01:05:36.559127,2026-03-21 21:49:00.769390
1212,CVE-2021-40870,"An issue was discovered in Aviatrix Controller 6.x before 6.5-1804.1922. Unrestricted upload of a file with a dangerous type is possible, which allows an unauthenticated user to execute arbitrary code via directory traversal.",9.8,,0.94,1,2021-09-13,Aviatrix,Aviatrix Controller,1,1,[],2026-03-20 01:05:36.560068,2026-03-21 22:12:31.555805
1213,CVE-2021-33766,Microsoft Exchange Server Information Disclosure Vulnerability,7.3,,0.94,1,2022-01-18,Microsoft,Exchange Server,1,1,[],2026-03-20 01:05:36.561040,2026-04-06 20:51:35.752383
1214,CVE-2021-21975,Server Side Request Forgery in vRealize Operations Manager API (CVE-2021-21975) prior to 8.4 may allow a malicious actor with network access to the vRealize Operations Manager API can perform a Server Side Request Forgery attack to steal administrative credentials.,7.5,,0.94,1,2022-01-18,VMware,vRealize Operations Manager API,1,1,[],2026-03-20 01:05:36.562059,2026-04-06 20:51:35.754672
1215,CVE-2021-21315,"The System Information Library for Node.JS (npm package ""systeminformation"") is an open source collection of functions to retrieve detailed hardware, system and OS information. In systeminformation before version 5.3.1 there is a command injection vulnerability. Problem was fixed in version 5.3.1. As a workaround instead of upgrading, be sure to check or sanitize service parameters that are passed to si.inetLatency(), si.inetChecksite(), si.services(), si.processLoad() ... do only allow strings,",7.1,CVSS:3.1/AV:L/AC:L/PR:N/UI:N/S:C/C:N/I:H/A:N,0.94,1,2021-02-16,Npm package,System Information Library for Node.JS,1,1,[],2026-03-20 01:05:36.563000,2026-03-21 22:02:10.855488
1216,CVE-2021-22991,"On BIG-IP versions 16.0.x before 16.0.1.1, 15.1.x before 15.1.2.1, 14.1.x before 14.1.4, 13.1.x before 13.1.3.6, and 12.1.x before 12.1.5.3, undisclosed requests to a virtual server may be incorrectly handled by the Traffic Management Microkernel (TMM) URI normalization, which may trigger a buffer overflow, resulting in a DoS attack. In certain situations, it may theoretically allow bypass of URL based access control or remote code execution (RCE). Note: Software versions which have reached End ",9.8,,0.73,0.99,2021-03-31,F5,BIG-IP Traffic Management Microkernel,1,1,[],2026-03-20 01:05:36.563838,2026-03-21 23:01:20.151991
1217,CVE-2020-14864,"Vulnerability in the Oracle Business Intelligence Enterprise Edition product of Oracle Fusion Middleware (component: Installation). Supported versions that are affected are 5.5.0.0.0, 12.2.1.3.0 and 12.2.1.4.0. Easily exploitable vulnerability allows unauthenticated attacker with network access via HTTP to compromise Oracle Business Intelligence Enterprise Edition. Successful attacks of this vulnerability can result in unauthorized access to critical data or complete access to all Oracle Busines",7.5,,0.94,1,2022-01-18,Oracle,Intelligence Enterprise Edition,1,1,[],2026-03-20 01:05:36.564875,2026-04-06 20:51:35.756852
1218,CVE-2020-13671,"Drupal core does not properly sanitize certain filenames on uploaded files, which can lead to files being interpreted as the incorrect extension and served as the wrong MIME type or executed as PHP for certain hosting configurations. This issue affects: Drupal Drupal Core 9.0 versions prior to 9.0.8, 8.9 versions prior to 8.9.9, 8.8 versions prior to 8.8.11, and 7 versions prior to 7.74.",8.8,,0.05,0.89,2022-01-18,Drupal,Drupal core,1,1,[],2026-03-20 01:05:36.566090,2026-04-06 20:51:35.759078
1219,CVE-2020-11978,An issue was found in Apache Airflow versions 1.10.10 and below. A remote code/command injection vulnerability was discovered in one of the example DAGs shipped with Airflow which would allow any authenticated user to run arbitrary commands as the user running airflow worker/scheduler (depending on the executor in use). If you already have examples disabled by setting load_examples=False in the config then you are not vulnerable.,8.8,,0.94,1,2022-01-18,Apache,Airflow,1,1,[],2026-03-20 01:05:36.567034,2026-04-06 20:51:35.761318
1220,CVE-2020-13927,"The previous default setting for Airflow's Experimental API was to allow all API requests without authentication, but this poses security risks to users who miss this fact. From Airflow 1.10.11 the default has been changed to deny all requests by default and is documented at https://airflow.apache.org/docs/1.10.11/security.html#api-authentication. Note this change fixes it for new installs but existing users need to change their config to default `[api]auth_backend = airflow.api.auth.backend.den",9.8,,0.94,1,2022-01-18,Apache,Airflow's Experimental API,1,1,[],2026-03-20 01:05:36.567973,2026-04-06 20:51:35.763442
1221,CVE-2021-22017,Rhttproxy as used in vCenter Server contains a vulnerability due to improper implementation of URI normalization. A malicious actor with network access to port 443 on vCenter Server may exploit this issue to bypass proxy leading to internal endpoints being accessed.,5.3,,0.79,0.99,2022-01-10,VMware,vCenter Server,1,1,[],2026-03-20 01:05:36.568916,2026-04-06 20:51:35.765328
1222,CVE-2021-36260,"A command injection vulnerability in the web server of some Hikvision product. Due to the insufficient input validation, attacker can exploit the vulnerability to launch a command injection attack by sending some messages with malicious commands.",9.8,,0.94,1,2021-09-22,Hikvision,Security cameras web server,1,1,[],2026-03-20 01:05:36.569857,2026-03-21 22:06:37.853654
1223,CVE-2020-6572,Use after free in Media in Google Chrome prior to 81.0.4044.92 allowed a remote attacker to execute arbitrary code via a crafted HTML page.,8.8,CVSS:3.1/AV:N/AC:L/PR:N/UI:R/S:U/C:H/I:H/A:H,0.19,0.95,2022-01-10,Google,Chrome Media,1,1,[],2026-03-20 01:05:36.570797,2026-04-06 20:51:35.767566
1224,CVE-2019-1458,"An elevation of privilege vulnerability exists in Windows when the Win32k component fails to properly handle objects in memory, aka 'Win32k Elevation of Privilege Vulnerability'.",7.8,CVSS:3.1/AV:L/AC:L/PR:L/UI:N/S:U/C:H/I:H/A:H,0.92,1,2022-01-10,Microsoft,Win32k,1,1,[],2026-03-20 01:05:36.571727,2026-04-06 20:51:35.769818
1225,CVE-2013-3900,"Why is Microsoft republishing a CVE from 2013?
We are republishing CVE-2013-3900 in the Security Update Guide to update the Security Updates table and to inform customers that the EnableCertPaddingCheck is available in all currently supported versions of Windows 10 and Windows 11. While the format is different from the original CVE published in 2013, except for clarifications about how to configure the EnableCertPaddingCheck registry value, the information herein remains unchanged from the origi",5.5,,0.8,0.99,2022-01-10,Microsoft,WinVerifyTrust function,1,1,[],2026-03-20 01:05:36.572666,2026-04-06 20:51:35.772138
1226,CVE-2019-2725,"Vulnerability in the Oracle WebLogic Server component of Oracle Fusion Middleware (subcomponent: Web Services). Supported versions that are affected are 10.3.6.0.0 and 12.1.3.0.0. Easily exploitable vulnerability allows unauthenticated attacker with network access via HTTP to compromise Oracle WebLogic Server. Successful attacks of this vulnerability can result in takeover of Oracle WebLogic Server. CVSS 3.0 Base Score 9.8 (Confidentiality, Integrity and Availability impacts). CVSS Vector: (CVSS",9.8,CVSS:3.1/AV:N/AC:L/PR:N/UI:N/S:U/C:H/I:H/A:H,0.94,1,2022-01-10,Oracle,WebLogic Server,1,1,[],2026-03-20 01:05:36.573608,2026-04-06 20:51:35.774417
