id,cve_id,description,cvss_score,cvss_vector,epss_score,epss_percentile,published,vendor,product,is_in_kev,is_in_nist,references,created_at,updated_at
353,CVE-2024-9680,"An attacker was able to achieve code execution in the content process by exploiting a use-after-free in Animation timelines. We have had reports of this vulnerability being exploited in the wild. This vulnerability affects Firefox < 131.0.2, Firefox ESR < 128.3.1, Firefox ESR < 115.16.1, Thunderbird < 131.0.1, Thunderbird < 128.3.1, and Thunderbird < 115.16.0.",9.8,,0.31,0.97,2024-10-15,Mozilla,Firefox,1,1,[],2026-03-20 01:05:35.687986,2026-04-06 20:51:34.691806
354,CVE-2024-30088,Windows Kernel Elevation of Privilege Vulnerability,7,,0.85,0.99,2024-10-15,Microsoft,Windows ,1,1,[],2026-03-20 01:05:35.688924,2026-04-06 20:51:34.692873
355,CVE-2024-9380,An OS command injection vulnerability in the admin web console of Ivanti CSA before version 5.0.2 allows a remote authenticated attacker with admin privileges to obtain remote code execution.,7.2,,0.88,0.99,2024-10-09,Ivanti,Cloud Services Appliance (CSA),1,1,[],2026-03-20 01:05:35.689854,2026-04-06 20:51:34.695060
356,CVE-2024-9379,SQL injection in the admin web console of Ivanti CSA before version 5.0.2 allows a remote authenticated attacker with admin privileges to run arbitrary SQL statements.,6.5,,0.82,0.99,2024-10-09,Ivanti,Cloud Services Appliance (CSA),1,1,[],2026-03-20 01:05:35.690806,2026-04-06 20:51:34.697011
357,CVE-2024-23113,"A use of externally-controlled format string in Fortinet FortiOS versions 7.4.0 through 7.4.2, 7.2.0 through 7.2.6, 7.0.0 through 7.0.13, FortiProxy versions 7.4.0 through 7.4.2, 7.2.0 through 7.2.8, 7.0.0 through 7.0.14, FortiPAM versions 1.2.0, 1.1.0 through 1.1.2, 1.0.0 through 1.0.3, FortiSwitchManager versions 7.2.0 through 7.2.3, 7.0.0 through 7.0.3 allows attacker to execute unauthorized code or commands via specially crafted packets.",9.8,CVSS:3.1/AV:N/AC:L/PR:N/UI:N/S:U/C:H/I:H/A:H,0.57,0.98,2024-10-09,Fortinet,Multiple Products,1,1,[],2026-03-20 01:05:35.691765,2026-04-06 20:51:34.698456
358,CVE-2024-43573,Windows MSHTML Platform Spoofing Vulnerability,6.5,,0.19,0.95,2024-10-08,Microsoft,Windows,1,1,[],2026-03-20 01:05:35.692710,2026-04-06 20:51:34.699782
359,CVE-2024-43572,Microsoft Management Console Remote Code Execution Vulnerability,7.8,,0.45,0.98,2024-10-08,Microsoft,Windows,1,1,[],2026-03-20 01:05:35.693651,2026-04-06 20:51:34.700916
360,CVE-2024-43047,Memory corruption while maintaining memory maps of HLOS memory.,7.8,,0.02,0.82,2024-10-07,Qualcomm,Multiple Chipsets ,1,1,[],2026-03-20 01:05:35.694600,2026-03-21 23:45:05.224640
361,CVE-2024-45519,Synacor Zimbra Collaboration Suite (ZCS) contains an unspecified vulnerability in the postjournal service that may allow an unauthenticated user to execute commands.,10,CVSS:3.1/AV:N/AC:L/PR:N/UI:N/S:C/C:H/I:H/A:H,0.9414,0.99911,2024-10-02,Synacor,Zimbra Collaboration Suite (ZCS),1,1,[],2026-03-20 01:05:35.695810,2026-03-21 02:07:16.279789
362,CVE-2024-29824,An unspecified SQL Injection vulnerability in Core server of Ivanti EPM 2022 SU5 and prior allows an unauthenticated attacker within the same network to execute arbitrary code.,8.8,,0.94,1,2024-10-02,Ivanti,Endpoint Manager (EPM),1,1,[],2026-03-20 01:05:35.697065,2026-04-06 20:51:34.701928
363,CVE-2019-0344,"Due to unsafe deserialization used in SAP Commerce Cloud (virtualjdbc extension), versions 6.4, 6.5, 6.6, 6.7, 1808, 1811, 1905, it is possible to execute arbitrary code on a target machine with 'Hybris' user rights, resulting in Code Injection.",9.8,,0.41,0.97,2024-09-30,SAP,Commerce Cloud,1,1,[],2026-03-20 01:05:35.698004,2026-04-06 20:51:34.703261
364,CVE-2020-15415,"On DrayTek Vigor3900, Vigor2960, and Vigor300B devices before 1.5.1, cgi-bin/mainfunction.cgi/cvmcfgupload allows remote command execution via shell metacharacters in a filename when the text/x-python-script content type is used, a different issue than CVE-2020-14472.",9.8,,0.93,1,2020-06-30,DrayTek,Multiple Vigor Routers,1,1,[],2026-03-20 01:05:35.698941,2026-03-21 22:34:56.386393
365,CVE-2023-25280,OS Command injection vulnerability in D-Link DIR820LA1_FW105B03 allows attackers to escalate privileges to root via a crafted payload with the ping_addr parameter to ping.ccp.,9.8,,0.93,1,2023-03-16,D-Link,DIR-820 Router,1,1,[],2026-03-20 01:05:35.699879,2026-03-22 15:27:29.322521
366,CVE-2024-7593,Incorrect implementation of an authentication algorithm in Ivanti vTM other than versions 22.2R1 or 22.7R2 allows a remote unauthenticated attacker to bypass authentication of the admin panel.,9.8,,0.94,1,2024-09-24,Ivanti,Virtual Traffic Manager,1,1,[],2026-03-20 01:05:35.700824,2026-04-06 20:51:34.704522
367,CVE-2024-8963,Path Traversal in the Ivanti CSA before 4.6 Patch 519 allows a remote unauthenticated attacker to access restricted functionality.,9.4,,0.94,1,2024-09-19,Ivanti,Cloud Services Appliance (CSA),1,1,[],2026-03-20 01:05:35.701765,2026-04-06 20:51:34.705598
368,CVE-2020-14644,"Vulnerability in the Oracle WebLogic Server product of Oracle Fusion Middleware (component: Core). Supported versions that are affected are 12.2.1.3.0, 12.2.1.4.0 and 14.1.1.0.0. Easily exploitable vulnerability allows unauthenticated attacker with network access via IIOP, T3 to compromise Oracle WebLogic Server. Successful attacks of this vulnerability can result in takeover of Oracle WebLogic Server. CVSS 3.1 Base Score 9.8 (Confidentiality, Integrity and Availability impacts). CVSS Vector: (C",9.8,,0.94,1,2024-09-18,Oracle,WebLogic Server,1,1,[],2026-03-20 01:05:35.702713,2026-04-06 20:51:34.706679
369,CVE-2022-21445,Vulnerability in the Oracle Application Development Framework (ADF) product of Oracle Fusion Middleware (component: ADF Faces).  Supported versions that are affected are 12.2.1.3.0 and  12.2.1.4.0. Easily exploitable vulnerability allows unauthenticated attacker with network access via HTTP to compromise Oracle Application Development Framework (ADF).  Successful attacks of this vulnerability can result in takeover of Oracle Application Development Framework (ADF). Note: Oracle Application Devel,9.8,,0.92,1,2024-09-18,Oracle,ADF Faces,1,1,[],2026-03-20 01:05:35.703646,2026-04-06 20:51:34.707755
370,CVE-2020-0618,"A remote code execution vulnerability exists in Microsoft SQL Server Reporting Services when it incorrectly handles page requests, aka 'Microsoft SQL Server Reporting Services Remote Code Execution Vulnerability'.",8.8,,0.94,1,2024-09-18,Microsoft,SQL Server,1,1,[],2026-03-20 01:05:35.704777,2026-04-06 20:51:34.708832
371,CVE-2024-27348,"RCE-Remote Command Execution vulnerability in Apache HugeGraph-Server.This issue affects Apache HugeGraph-Server: from 1.0.0 before 1.3.0 in Java8 & Java11

Users are recommended to upgrade to version 1.3.0 with Java11 & enable the Auth system, which fixes the issue.",9.8,,0.94,1,2024-09-18,Apache,HugeGraph-Server,1,1,[],2026-03-20 01:05:35.705726,2026-04-06 20:51:34.709908
372,CVE-2014-0502,"Double free vulnerability in Adobe Flash Player before 11.7.700.269 and 11.8.x through 12.0.x before 12.0.0.70 on Windows and Mac OS X and before 11.2.202.341 on Linux, Adobe AIR before 4.0.0.1628 on Android, Adobe AIR SDK before 4.0.0.1628, and Adobe AIR SDK & Compiler before 4.0.0.1628 allows remote attackers to execute arbitrary code via unspecified vectors, as exploited in the wild in February 2014.",8.8,,0.89,1,2024-09-17,Adobe,Flash Player,1,1,[],2026-03-20 01:05:35.706878,2026-04-06 20:51:34.711389
373,CVE-2013-0648,"Unspecified vulnerability in the ExternalInterface ActionScript functionality in Adobe Flash Player before 10.3.183.67 and 11.x before 11.6.602.171 on Windows and Mac OS X, and before 10.3.183.67 and 11.x before 11.2.202.273 on Linux, allows remote attackers to execute arbitrary code via crafted SWF content, as exploited in the wild in February 2013.",8.8,CVSS:3.1/AV:N/AC:L/PR:N/UI:R/S:U/C:H/I:H/A:H,0.55,0.98,2024-09-17,Adobe,Flash Player,1,1,[],2026-03-20 01:05:35.707996,2026-04-06 20:51:34.712440
374,CVE-2013-0643,"The Firefox sandbox in Adobe Flash Player before 10.3.183.67 and 11.x before 11.6.602.171 on Windows and Mac OS X, and before 10.3.183.67 and 11.x before 11.2.202.273 on Linux, does not properly restrict privileges, which makes it easier for remote attackers to execute arbitrary code via crafted SWF content, as exploited in the wild in February 2013.",8.8,,0.58,0.98,2024-09-17,Adobe,Flash Player,1,1,[],2026-03-20 01:05:35.709076,2026-04-06 20:51:34.713410
375,CVE-2014-0497,"Integer underflow in Adobe Flash Player before 11.7.700.261 and 11.8.x through 12.0.x before 12.0.0.44 on Windows and Mac OS X, and before 11.2.202.336 on Linux, allows remote attackers to execute arbitrary code via unspecified vectors.",9.8,CVSS:3.1/AV:N/AC:L/PR:N/UI:N/S:U/C:H/I:H/A:H,0.93,1,2024-09-17,Adobe,Flash Player,1,1,[],2026-03-20 01:05:35.710093,2026-04-06 20:51:34.715090
376,CVE-2024-6670,"In WhatsUp Gold versions released before 2024.0.0, a SQL Injection vulnerability allows an unauthenticated attacker to retrieve the users encrypted password.",9.8,,0.94,1,2024-08-29,Progress,WhatsUp Gold,1,1,[],2026-03-20 01:05:35.711038,2026-03-21 22:05:41.978224
377,CVE-2024-43461,Windows MSHTML Platform Spoofing Vulnerability,8.8,CVSS:3.1/AV:N/AC:L/PR:N/UI:R/S:U/C:H/I:H/A:H,0.1,0.93,2024-09-16,Microsoft,Windows,1,1,[],2026-03-20 01:05:35.711961,2026-04-06 20:51:34.717300
378,CVE-2024-8190,An OS command injection vulnerability in Ivanti Cloud Services Appliance versions 4.6 Patch 518 and before allows a remote authenticated attacker to obtain remote code execution. The attacker must have admin level privileges to exploit this vulnerability.,7.2,,0.92,1,2024-09-13,Ivanti,Cloud Services Appliance,1,1,[],2026-03-20 01:05:35.712883,2026-04-06 20:51:34.718704
379,CVE-2024-38217,Windows Mark of the Web Security Feature Bypass Vulnerability,5.4,,0.13,0.94,2024-09-10,Microsoft,Windows,1,1,[],2026-03-20 01:05:35.713841,2026-04-06 20:51:34.720122
380,CVE-2024-38014,Windows Installer Elevation of Privilege Vulnerability,7.8,,0.13,0.94,2024-09-10,Microsoft,Windows,1,1,[],2026-03-20 01:05:35.714769,2026-04-06 20:51:34.721318
381,CVE-2024-38226,Microsoft Publisher Security Feature Bypass Vulnerability,7.3,,0.01,0.81,2024-09-10,Microsoft,Publisher,1,1,[],2026-03-20 01:05:35.715826,2026-04-06 20:51:34.722361
382,CVE-2024-40766,"An improper access control vulnerability has been identified in the SonicWall SonicOS management access, potentially leading to unauthorized resource access and in specific conditions, causing the firewall to crash. This issue affects SonicWall Firewall Gen 5 and Gen 6 devices, as well as Gen 7 devices running SonicOS 7.0.1-5035 and older versions.",9.8,CVSS:3.1/AV:N/AC:L/PR:N/UI:N/S:U/C:H/I:H/A:H,0.03,0.87,2024-08-23,SonicWall,SonicOS,1,1,[],2026-03-20 01:05:35.716786,2026-03-21 21:45:35.275788
383,CVE-2017-1000253,"Linux distributions that have not patched their long-term kernels with https://git.kernel.org/linus/a87938b2e246b81b4fb713edb371a9fa3c5c3c86 (committed on April 14, 2015). This kernel vulnerability was fixed in April 2015 by commit a87938b2e246b81b4fb713edb371a9fa3c5c3c86 (backported to Linux 3.10.77 in May 2015), but it was not recognized as a security threat. With CONFIG_ARCH_BINFMT_ELF_RANDOMIZE_PIE enabled, and a normal top-down address allocation strategy, load_elf_binary() will attempt to ",7.8,,0.54,0.98,2017-10-05,Linux,Kernel,1,1,[],2026-03-20 01:05:35.717656,2026-03-21 23:08:28.976982
384,CVE-2016-3714,"ImageMagick contains an improper input validation vulnerability that affects the EPHEMERAL, HTTPS, MVG, MSL, TEXT, SHOW, WIN, and PLT coders. This allows a remote attacker to execute arbitrary code via shell metacharacters in a crafted image.",8.4,CVSS:3.1/AV:L/AC:L/PR:N/UI:N/S:U/C:H/I:H/A:H,0.93749,0.99849,2016-05-05,ImageMagick,ImageMagick,1,1,[],2026-03-20 01:05:35.718804,2026-03-21 02:07:16.546834
385,CVE-2024-7262,"Improper path validation in promecefpluginhost.exe in Kingsoft WPS Office version ranging from 12.2.0.13110 to 12.2.0.16412 (exclusive) on Windows allows an attacker to load an arbitrary Windows library.
The vulnerability was found weaponized as a single-click exploit in the form of a deceptive spreadsheet document",7.8,,0.16,0.95,2024-08-15,Kingsoft,WPS Office,1,1,[],2026-03-20 01:05:35.719737,2026-03-21 23:27:22.983711
386,CVE-2021-20124,A local file inclusion vulnerability exists in Draytek VigorConnect 1.6.0-B3 in the file download functionality of the WebServlet endpoint. An unauthenticated attacker could leverage this vulnerability to download arbitrary files from the underlying operating system with root privileges.,7.5,,0.94,1,2021-10-13,DrayTek,VigorConnect,1,1,[],2026-03-20 01:05:35.720666,2026-03-21 22:13:39.908560
387,CVE-2021-20123,A local file inclusion vulnerability exists in Draytek VigorConnect 1.6.0-B3 in the file download functionality of the DownloadFileServlet endpoint. An unauthenticated attacker could leverage this vulnerability to download arbitrary files from the underlying operating system with root privileges.,7.5,,0.94,1,2021-10-13,DrayTek,VigorConnect,1,1,[],2026-03-20 01:05:35.721610,2026-03-21 22:31:18.252252
388,CVE-2024-7965,Inappropriate implementation in V8 in Google Chrome prior to 128.0.6613.84 allowed a remote attacker to potentially exploit heap corruption via a crafted HTML page. (Chromium security severity: High),8.8,,0.27,0.96,2024-08-28,Google,Chromium V8,1,1,[],2026-03-20 01:05:35.722831,2026-04-06 20:51:34.723438
389,CVE-2024-38856,"Incorrect Authorization vulnerability in Apache OFBiz.

This issue affects Apache OFBiz: through 18.12.14.

Users are recommended to upgrade to version 18.12.15, which fixes the issue.

Unauthenticated endpoints could allow execution of screen rendering code of screens if some preconditions are met (such as when the screen definitions don't explicitly check user's permissions because they rely on the configuration of their endpoints).",9.8,,0.94,1,2024-08-27,Apache,OFBiz,1,1,[],2026-03-20 01:05:35.723821,2026-04-06 20:51:34.724613
390,CVE-2024-7971,Type confusion in V8 in Google Chrome prior to 128.0.6613.84 allowed a remote attacker to exploit heap corruption via a crafted HTML page. (Chromium security severity: High),9.6,,0.01,0.77,2024-08-26,Google,Chromium V8,1,1,"[""https://github.com/mistymntncop/CVE-2024-7971""]",2026-03-20 01:05:35.724883,2026-04-06 20:51:34.725631
391,CVE-2024-39717,The Versa Director GUI provides an option to customize the look and feel of the user interface. This option is only available for a user logged with Provider-Data-Center-Admin or Provider-Data-Center-System-Admin. (Tenant level users do not have this privilege). The “Change Favicon” (Favorite Icon) option can be mis-used to upload a malicious file ending with .png extension to masquerade as image file. This is possible only after a user with Provider-Data-Center-Admin or Provider-Data-Center-Sys,7.2,,0.05,0.89,2024-08-22,Versa,Director,1,1,[],2026-03-20 01:05:35.725730,2026-03-21 23:38:40.143796
392,CVE-2021-31196,Microsoft Exchange Server Remote Code Execution Vulnerability,7.2,,0.03,0.87,2024-08-21,Microsoft,Exchange Server,1,1,[],2026-03-20 01:05:35.726676,2026-04-06 20:51:34.726665
393,CVE-2022-0185,"A heap-based buffer overflow flaw was found in the way the legacy_parse_param function in the Filesystem Context functionality of the Linux kernel verified the supplied parameters length. An unprivileged (in case of unprivileged user namespaces enabled, otherwise needs namespaced CAP_SYS_ADMIN privilege) local user able to open a filesystem that does not support the Filesystem Context API (and thus fallbacks to legacy handling) could use this flaw to escalate their privileges on the system.",8.4,,0.02,0.81,2022-02-11,Linux,Kernel,1,1,[],2026-03-20 01:05:35.727615,2026-03-21 23:45:48.674046
394,CVE-2021-33045,The identity authentication bypass vulnerability found in some Dahua products during the login process. Attackers can bypass device identity authentication by constructing malicious data packets.,9.8,,0.94,1,2021-09-15,Dahua,IP Camera Firmware,1,1,[],2026-03-20 01:05:35.728560,2026-03-21 22:12:56.281953
395,CVE-2021-33044,The identity authentication bypass vulnerability found in some Dahua products during the login process. Attackers can bypass device identity authentication by constructing malicious data packets.,9.8,,0.94,1,2021-09-15,Dahua,IP Camera Firmware,1,1,[],2026-03-20 01:05:35.729508,2026-03-21 22:11:29.647890
396,CVE-2024-23897,"Jenkins 2.441 and earlier, LTS 2.426.2 and earlier does not disable a feature of its CLI command parser that replaces an '@' character followed by a file path in an argument with the file's contents, allowing unauthenticated attackers to read arbitrary files on the Jenkins controller file system.",9.8,,0.94,1,2024-01-24,Jenkins,Jenkins Command Line Interface (CLI),1,1,[],2026-03-20 01:05:35.730541,2026-03-21 22:05:54.326667
397,CVE-2024-28986,"SolarWinds Web Help Desk was found to be susceptible to a Java Deserialization Remote Code Execution vulnerability that, if exploited, would allow an attacker to run commands on the host machine. 

While it was reported as an unauthenticated vulnerability, SolarWinds has been unable to reproduce it without authentication after thorough testing.  

However, out of an abundance of caution, we recommend all Web Help Desk customers apply the patch, which is now available.",9.8,,0.78,0.99,2024-08-15,SolarWinds,Web Help Desk,1,1,[],2026-03-20 01:05:35.731472,2026-04-06 20:51:34.727751
398,CVE-2024-38107,Windows Power Dependency Coordinator Elevation of Privilege Vulnerability,7.8,CVSS:3.1/AV:L/AC:L/PR:L/UI:N/S:U/C:H/I:H/A:H,0.03,0.87,2024-08-13,Microsoft,Windows,1,1,[],2026-03-20 01:05:35.732411,2026-04-06 20:51:34.730652
399,CVE-2024-38106,Windows Kernel Elevation of Privilege Vulnerability,7,,0.01,0.73,2024-08-13,Microsoft,Windows,1,1,[],2026-03-20 01:05:35.733378,2026-04-06 20:51:34.732897
400,CVE-2024-38193,Windows Ancillary Function Driver for WinSock Elevation of Privilege Vulnerability,7.8,,0.75,0.99,2024-08-13,Microsoft,Windows,1,1,[],2026-03-20 01:05:35.734619,2026-04-06 20:51:34.734989
401,CVE-2024-38213,Windows Mark of the Web Security Feature Bypass Vulnerability,6.5,,0.59,0.98,2024-08-13,Microsoft,Windows,1,1,[],2026-03-20 01:05:35.735600,2026-04-06 20:51:34.737152
402,CVE-2024-38178,Scripting Engine Memory Corruption Vulnerability,7.5,,0.26,0.96,2024-08-13,Microsoft,Windows,1,1,[],2026-03-20 01:05:35.736554,2026-04-06 20:51:34.739107
403,CVE-2024-38189,Microsoft Project Remote Code Execution Vulnerability,8.8,,0.44,0.97,2024-08-13,Microsoft,Project,1,1,[],2026-03-20 01:05:35.737499,2026-04-06 20:51:34.740912
404,CVE-2024-32113,"Improper Limitation of a Pathname to a Restricted Directory ('Path Traversal') vulnerability in Apache OFBiz.This issue affects Apache OFBiz: before 18.12.13.

Users are recommended to upgrade to version 18.12.13, which fixes the issue.",9.8,CVSS:3.1/AV:N/AC:L/PR:N/UI:N/S:U/C:H/I:H/A:H,0.94,1,2024-08-07,Apache,OFBiz,1,1,[],2026-03-20 01:05:35.738429,2026-04-06 20:51:34.742697
405,CVE-2024-36971,"In the Linux kernel, the following vulnerability has been resolved:

net: fix __dst_negative_advice() race

__dst_negative_advice() does not enforce proper RCU rules when
sk->dst_cache must be cleared, leading to possible UAF.

RCU rules are that we must first clear sk->sk_dst_cache,
then call dst_release(old_dst).

Note that sk_dst_reset(sk) is implementing this protocol correctly,
while __dst_negative_advice() uses the wrong order.

Given that ip6_negative_advice() has special logic
against RT",7.8,CVSS:3.1/AV:L/AC:L/PR:L/UI:N/S:U/C:H/I:H/A:H,0,0.63,2024-06-10,Android,Kernel,1,1,[],2026-03-20 01:05:35.739370,2026-03-21 21:59:41.308922
406,CVE-2018-0824,"A remote code execution vulnerability exists in ""Microsoft COM for Windows"" when it fails to properly handle serialized objects, aka ""Microsoft COM for Windows Remote Code Execution Vulnerability."" This affects Windows 7, Windows Server 2012 R2, Windows RT 8.1, Windows Server 2008, Windows Server 2012, Windows 8.1, Windows Server 2016, Windows Server 2008 R2, Windows 10, Windows 10 Servers.",8.8,CVSS:3.1/AV:N/AC:L/PR:N/UI:R/S:U/C:H/I:H/A:H,0.92,1,2024-08-05,Microsoft,Windows,1,1,[],2026-03-20 01:05:35.740329,2026-04-06 20:51:34.744897
407,CVE-2024-37085,VMware ESXi contains an authentication bypass vulnerability. A malicious actor with sufficient Active Directory (AD) permissions can gain full access to an ESXi host that was previously  configured to use AD for user management https://blogs.vmware.com/vsphere/2012/09/joining-vsphere-hosts-to-active-directory.html  by re-creating the configured AD group ('ESXi Admins' by default) after it was deleted from AD.,6.8,,0.72,0.99,2024-07-30,VMware,ESXi,1,1,"[""https://github.com/Florian-Hoth/CVE-2024-37085-RCE-POC""]",2026-03-20 01:05:35.741169,2026-04-06 20:51:34.747170
408,CVE-2023-45249,"Remote command execution due to use of default passwords. The following products are affected: Acronis Cyber Infrastructure (ACI) before build 5.0.1-61, Acronis Cyber Infrastructure (ACI) before build 5.1.1-71, Acronis Cyber Infrastructure (ACI) before build 5.2.1-69, Acronis Cyber Infrastructure (ACI) before build 5.3.1-53, Acronis Cyber Infrastructure (ACI) before build 5.4.4-132.",9.8,CVSS:3.1/AV:N/AC:L/PR:N/UI:N/S:U/C:H/I:H/A:H,0.93,1,2024-07-24,Acronis,Cyber Infrastructure (ACI),1,1,[],2026-03-20 01:05:35.742003,2026-03-21 21:40:20.571581
409,CVE-2024-5217,"ServiceNow has addressed an input validation vulnerability that was identified in the Washington DC, Vancouver, and earlier Now Platform releases. This vulnerability could enable an unauthenticated user to remotely execute code within the context of the Now Platform. The vulnerability is addressed in the listed patches and hot fixes below, which were released during the June 2024 patching cycle. If you have not done so already, we recommend applying security patches relevant to your instance as ",9.8,,0.94,1,2024-07-29,ServiceNow,"Utah, Vancouver, and Washington DC Now Platform",1,1,[],2026-03-20 01:05:35.742941,2026-04-06 20:51:34.749169
410,CVE-2024-4879,"ServiceNow has addressed an input validation vulnerability that was identified in Vancouver and Washington DC Now Platform releases. This vulnerability could enable an unauthenticated user to remotely execute code within the context of the Now Platform. ServiceNow applied an update to hosted instances, and ServiceNow released the update to our partners and self-hosted customers. Listed below are the patches and hot fixes that address the vulnerability. If you have not done so already, we recomme",9.8,,0.94,1,2024-07-29,ServiceNow,"Utah, Vancouver, and Washington DC Now Platform",1,1,[],2026-03-20 01:05:35.744485,2026-04-06 20:51:34.751620
411,CVE-2024-39891,"In the Twilio Authy API, accessed by Authy Android before 25.1.0 and Authy iOS before 26.1.0, an unauthenticated endpoint provided access to certain phone-number data, as exploited in the wild in June 2024. Specifically, the endpoint accepted a stream of requests containing phone numbers, and responded with information about whether each phone number was registered with Authy. (Authy accounts were not compromised, however.)",5.3,,0.3,0.97,2024-07-02,Twilio,Authy,1,1,[],2026-03-20 01:05:35.745641,2026-03-21 23:19:37.680990
412,CVE-2012-4792,"Use-after-free vulnerability in Microsoft Internet Explorer 6 through 8 allows remote attackers to execute arbitrary code via a crafted web site that triggers access to an object that (1) was not properly allocated or (2) is deleted, as demonstrated by a CDwnBindInfo object, and exploited in the wild in December 2012.",8.8,,0.91,1,2024-07-23,Microsoft,Internet Explorer,1,1,[],2026-03-20 01:05:35.746715,2026-04-06 20:51:34.754027
413,CVE-2022-22948,The vCenter Server contains an information disclosure vulnerability due to improper permission of files. A malicious actor with non-administrative access to the vCenter Server may exploit this issue to gain access to sensitive information.,6.5,,0.26,0.96,2024-07-17,VMware,vCenter Server,1,1,[],2026-03-20 01:05:35.748006,2026-04-06 20:51:34.756136
414,CVE-2024-28995,SolarWinds Serv-U was susceptible to a directory transversal vulnerability that would allow access to read sensitive files on the host machine.,8.6,,0.94,1,2024-07-17,SolarWinds,Serv-U,1,1,[],2026-03-20 01:05:35.748999,2026-04-06 20:51:34.757955
415,CVE-2024-34102,"Adobe Commerce versions 2.4.7, 2.4.6-p5, 2.4.5-p7, 2.4.4-p8 and earlier are affected by an Improper Restriction of XML External Entity Reference ('XXE') vulnerability that could result in arbitrary code execution. An attacker could exploit this vulnerability by sending a crafted XML document that references external entities. Exploitation of this issue does not require user interaction.",9.8,,0.94,1,2024-07-17,Adobe,Commerce and Magento Open Source,1,1,[],2026-03-20 01:05:35.750002,2026-04-06 20:51:34.759755
416,CVE-2024-36401,"GeoServer is an open source server that allows users to share and edit geospatial data. Prior to versions 2.22.6, 2.23.6, 2.24.4, and 2.25.2, multiple OGC request parameters allow Remote Code Execution (RCE) by unauthenticated users through specially crafted input against a default GeoServer installation due to unsafely evaluating property names as XPath expressions.

The GeoTools library API that GeoServer calls evaluates property/attribute names for feature types in a way that unsafely passes ",9.8,,0.94,1,2024-07-01,OSGeo,GeoServer,1,1,[],2026-03-20 01:05:35.751029,2026-03-21 22:07:02.615856
